28-08-2013 05:06:31	SELECT f_almacena_lectura(0, 0, 0, '2013-08-28 17:06:31', 2, 51, '466536000000000000000000')
28-08-2013 05:06:37	SELECT f_almacena_lectura(0, 0, 1, '2013-08-28 17:06:37', 2, 51, '466536000000000000000000')
29-08-2013 03:20:02	SELECT f_almacena_lectura(0, 0, 0, '2013-08-29 15:20:02', 1, 51, '466536000000000000000000')
29-08-2013 03:20:08	SELECT f_almacena_lectura(0, 0, 1, '2013-08-29 15:20:08', 1, 51, '466536000000000000000000')
29-08-2013 03:20:37	SELECT f_almacena_lectura(0, 0, 0, '2013-08-29 15:20:37', 2, 51, '466536000000000000000000')
29-08-2013 03:20:37	nuevo tag para lectura 2
29-08-2013 03:20:42	SELECT f_almacena_lectura(0, 0, 1, '2013-08-29 15:20:42', 2, 51, '466536000000000000000000')
29-08-2013 03:20:51	SELECT f_almacena_lectura(0, 0, 0, '2013-08-29 15:20:51', 2, 51, '3005fb63ac1f3841ec880469')
29-08-2013 03:20:51	nuevo tag para lectura 2
29-08-2013 03:20:57	SELECT f_almacena_lectura(0, 0, 1, '2013-08-29 15:20:57', 2, 51, '3005fb63ac1f3841ec880469')
29-08-2013 05:36:50	SELECT f_almacena_lectura(0, 0, 0, '2013-08-29 17:36:50', 2, 51, '466536000000000000000000')
29-08-2013 05:36:55	SELECT f_almacena_lectura(0, 0, 1, '2013-08-29 17:36:55', 2, 51, '466536000000000000000000')
29-08-2013 05:39:25	SELECT f_almacena_lectura(0, 0, 0, '2013-08-29 17:39:25', 2, 47, '466536000000000000000000')
29-08-2013 05:39:27	SELECT f_almacena_lectura(0, 0, 0, '2013-08-29 17:39:27', 2, 51, '466536000000000000000000')
29-08-2013 05:39:31	SELECT f_almacena_lectura(0, 0, 1, '2013-08-29 17:39:31', 2, 47, '466536000000000000000000')
29-08-2013 05:39:33	SELECT f_almacena_lectura(0, 0, 1, '2013-08-29 17:39:33', 2, 51, '466536000000000000000000')
29-08-2013 05:40:12	SELECT f_almacena_lectura(0, 0, 0, '2013-08-29 17:40:12', 2, 47, '466536000000000000000000')
29-08-2013 05:40:12	nuevo tag para lectura 2
29-08-2013 05:40:17	SELECT f_almacena_lectura(0, 0, 1, '2013-08-29 17:40:17', 2, 47, '466536000000000000000000')
29-08-2013 05:40:24	SELECT f_almacena_lectura(0, 0, 0, '2013-08-29 17:40:24', 2, 51, '466536000000000000000000')
29-08-2013 05:40:24	nuevo tag para lectura 2
29-08-2013 05:40:30	SELECT f_almacena_lectura(0, 0, 1, '2013-08-29 17:40:30', 2, 51, '466536000000000000000000')
29-08-2013 05:40:32	SELECT f_almacena_lectura(0, 0, 0, '2013-08-29 17:40:32', 2, 47, '466536000000000000000000')
29-08-2013 05:40:33	SELECT f_almacena_lectura(0, 0, 0, '2013-08-29 17:40:33', 2, 47, '3005fb63ac1f3841ec880469')
29-08-2013 05:40:33	nuevo tag para lectura 2
29-08-2013 05:40:37	SELECT f_almacena_lectura(0, 0, 1, '2013-08-29 17:40:37', 2, 47, '466536000000000000000000')
29-08-2013 05:40:38	SELECT f_almacena_lectura(0, 0, 1, '2013-08-29 17:40:38', 2, 47, '3005fb63ac1f3841ec880469')
29-08-2013 05:41:39	SELECT f_almacena_lectura(0, 0, 0, '2013-08-29 17:41:39', 2, 47, '466536000000000000000000')
29-08-2013 05:41:39	nuevo tag para lectura 2
29-08-2013 05:41:43	SELECT f_almacena_lectura(0, 0, 0, '2013-08-29 17:41:43', 2, 47, '3005fb63ac1f3841ec880469')
29-08-2013 05:41:43	nuevo tag para lectura 2
29-08-2013 05:41:43	SELECT f_almacena_lectura(0, 0, 0, '2013-08-29 17:41:43', 2, 47, '3005fb63ac1f3841ec880467')
29-08-2013 05:41:43	nuevo tag para lectura 2
29-08-2013 05:41:44	SELECT f_almacena_lectura(0, 0, 1, '2013-08-29 17:41:44', 2, 47, '466536000000000000000000')
29-08-2013 05:41:48	SELECT f_almacena_lectura(0, 0, 1, '2013-08-29 17:41:48', 2, 47, '3005fb63ac1f3841ec880467')
29-08-2013 05:41:48	SELECT f_almacena_lectura(0, 0, 1, '2013-08-29 17:41:48', 2, 47, '3005fb63ac1f3841ec880469')
29-08-2013 05:41:53	SELECT f_almacena_lectura(0, 0, 0, '2013-08-29 17:41:53', 2, 51, 'e2801130200020c3db8b00ab')
29-08-2013 05:41:53	nuevo tag para lectura 2
29-08-2013 05:41:53	SELECT f_almacena_lectura(0, 0, 0, '2013-08-29 17:41:53', 2, 51, '300833b2ddd9014000000000')
29-08-2013 05:41:53	nuevo tag para lectura 2
29-08-2013 05:41:57	SELECT f_almacena_lectura(0, 0, 0, '2013-08-29 17:41:57', 2, 47, '300833b2ddd9014000000000')
29-08-2013 05:41:57	nuevo tag para lectura 2
29-08-2013 05:41:57	SELECT f_almacena_lectura(0, 0, 0, '2013-08-29 17:41:57', 2, 47, 'e2801130200020c3db8b00ab')
29-08-2013 05:41:57	nuevo tag para lectura 2
29-08-2013 05:42:00	SELECT f_almacena_lectura(0, 0, 1, '2013-08-29 17:42:00', 2, 51, '300833b2ddd9014000000000')
29-08-2013 05:42:01	SELECT f_almacena_lectura(0, 0, 1, '2013-08-29 17:42:01', 2, 51, 'e2801130200020c3db8b00ab')
29-08-2013 05:42:02	SELECT f_almacena_lectura(0, 0, 1, '2013-08-29 17:42:02', 2, 47, '300833b2ddd9014000000000')
29-08-2013 05:42:02	SELECT f_almacena_lectura(0, 0, 1, '2013-08-29 17:42:02', 2, 47, 'e2801130200020c3db8b00ab')
29-08-2013 05:42:07	SELECT f_almacena_lectura(0, 0, 0, '2013-08-29 17:42:07', 2, 51, '300833b2ddd9014000000000')
29-08-2013 05:42:10	SELECT f_almacena_lectura(0, 0, 0, '2013-08-29 17:42:10', 2, 47, '300833b2ddd9014000000000')
29-08-2013 05:42:13	SELECT f_almacena_lectura(0, 0, 1, '2013-08-29 17:42:13', 2, 51, '300833b2ddd9014000000000')
29-08-2013 05:42:15	SELECT f_almacena_lectura(0, 0, 1, '2013-08-29 17:42:15', 2, 47, '300833b2ddd9014000000000')
29-08-2013 05:42:21	SELECT f_almacena_lectura(0, 0, 0, '2013-08-29 17:42:21', 2, 51, '300833b2ddd9bd0400bb97ff')
29-08-2013 05:42:21	nuevo tag para lectura 2
29-08-2013 05:42:24	SELECT f_almacena_lectura(0, 0, 0, '2013-08-29 17:42:24', 2, 47, '300833b2ddd9bd0400bb97ff')
29-08-2013 05:42:24	nuevo tag para lectura 2
29-08-2013 05:42:26	SELECT f_almacena_lectura(0, 0, 1, '2013-08-29 17:42:26', 2, 51, '300833b2ddd9bd0400bb97ff')
29-08-2013 05:42:29	SELECT f_almacena_lectura(0, 0, 1, '2013-08-29 17:42:29', 2, 47, '300833b2ddd9bd0400bb97ff')
29-08-2013 05:46:41	SELECT f_almacena_lectura(0, 0, 0, '2013-08-29 17:46:41', 2, 51, '466536000000000000000000')
29-08-2013 05:46:41	nuevo tag para lectura 2
29-08-2013 05:46:47	SELECT f_almacena_lectura(0, 0, 1, '2013-08-29 17:46:47', 2, 51, '466536000000000000000000')
29-08-2013 05:46:48	SELECT f_almacena_lectura(0, 0, 0, '2013-08-29 17:46:48', 2, 47, '466536000000000000000000')
29-08-2013 05:46:48	nuevo tag para lectura 2
29-08-2013 05:46:48	SELECT f_almacena_lectura(0, 0, 0, '2013-08-29 17:46:48', 2, 47, '3005fb63ac1f3841ec880467')
29-08-2013 05:46:48	nuevo tag para lectura 2
29-08-2013 05:46:53	SELECT f_almacena_lectura(0, 0, 1, '2013-08-29 17:46:53', 2, 47, '466536000000000000000000')
29-08-2013 05:46:54	SELECT f_almacena_lectura(0, 0, 1, '2013-08-29 17:46:54', 2, 47, '3005fb63ac1f3841ec880467')
29-08-2013 05:48:48	SELECT f_almacena_lectura(0, 0, 0, '2013-08-29 17:48:48', 2, 51, '466536000000000000000000')
29-08-2013 05:48:48	nuevo tag para lectura 2
29-08-2013 05:48:50	SELECT f_almacena_lectura(0, 0, 0, '2013-08-29 17:48:50', 2, 47, '466536000000000000000000')
29-08-2013 05:48:50	nuevo tag para lectura 2
29-08-2013 05:48:54	SELECT f_almacena_lectura(0, 0, 1, '2013-08-29 17:48:54', 2, 51, '466536000000000000000000')
29-08-2013 05:48:55	SELECT f_almacena_lectura(0, 0, 1, '2013-08-29 17:48:55', 2, 47, '466536000000000000000000')
30-08-2013 09:40:55	SELECT f_almacena_lectura(0, 0, 0, '2013-08-30 09:40:55', 2, 47, '3005fb63ac1f3841ec880467')
30-08-2013 09:41:37	SELECT f_almacena_lectura(0, 0, 1, '2013-08-30 09:41:37', 2, 47, '3005fb63ac1f3841ec880467')
30-08-2013 09:42:18	SELECT f_almacena_lectura(0, 0, 0, '2013-08-30 09:42:18', 2, 51, '2658000000000000000d57')
30-08-2013 09:42:21	SELECT f_almacena_lectura(0, 0, 0, '2013-08-30 09:42:21', 2, 47, '2658000000000000000d57')
30-08-2013 09:42:24	SELECT f_almacena_lectura(0, 0, 1, '2013-08-30 09:42:24', 2, 51, '2658000000000000000d57')
30-08-2013 09:42:27	SELECT f_almacena_lectura(0, 0, 1, '2013-08-30 09:42:27', 2, 47, '2658000000000000000d57')
30-08-2013 09:45:53	SELECT f_almacena_lectura(0, 0, 0, '2013-08-30 09:45:53', 2, 51, '2658000000000000000d57')
30-08-2013 09:45:58	SELECT f_almacena_lectura(0, 0, 1, '2013-08-30 09:45:58', 2, 51, '2658000000000000000d57')
30-08-2013 09:45:59	SELECT f_almacena_lectura(0, 0, 0, '2013-08-30 09:45:59', 2, 51, '2658000000000000000d57')
30-08-2013 09:46:05	SELECT f_almacena_lectura(0, 0, 1, '2013-08-30 09:46:05', 2, 51, '2658000000000000000d57')
30-08-2013 09:46:06	SELECT f_almacena_lectura(0, 0, 0, '2013-08-30 09:46:06', 2, 47, '2658000000000000000d57')
30-08-2013 09:46:06	nuevo tag para lectura 1
30-08-2013 09:46:18	SELECT f_almacena_lectura(0, 0, 1, '2013-08-30 09:46:18', 2, 47, '2658000000000000000d57')
30-08-2013 09:46:19	SELECT f_almacena_lectura(0, 0, 0, '2013-08-30 09:46:19', 2, 51, '2658000000000000000d57')
30-08-2013 09:46:25	SELECT f_almacena_lectura(0, 0, 1, '2013-08-30 09:46:25', 2, 51, '2658000000000000000d57')
30-08-2013 09:46:32	SELECT f_almacena_lectura(0, 0, 0, '2013-08-30 09:46:32', 2, 47, '2658000000000000000d57')
30-08-2013 09:46:37	SELECT f_almacena_lectura(0, 0, 1, '2013-08-30 09:46:37', 2, 47, '2658000000000000000d57')
30-08-2013 09:46:44	SELECT f_almacena_lectura(0, 0, 0, '2013-08-30 09:46:44', 2, 47, '466536000000000000000000')
30-08-2013 09:46:45	nuevo tag para lectura 1
30-08-2013 09:46:47	SELECT f_almacena_lectura(0, 0, 0, '2013-08-30 09:46:47', 2, 51, '466536000000000000000000')
30-08-2013 09:46:50	SELECT f_almacena_lectura(0, 0, 1, '2013-08-30 09:46:50', 2, 47, '466536000000000000000000')
30-08-2013 09:46:52	SELECT f_almacena_lectura(0, 0, 1, '2013-08-30 09:46:52', 2, 51, '466536000000000000000000')
30-08-2013 09:46:52	SELECT f_almacena_lectura(0, 0, 0, '2013-08-30 09:46:52', 2, 51, '466536000000000000000000')
30-08-2013 09:46:58	SELECT f_almacena_lectura(0, 0, 1, '2013-08-30 09:46:58', 2, 51, '466536000000000000000000')
30-08-2013 09:51:15	SELECT f_almacena_lectura(0, 0, 0, '2013-08-30 09:51:15', 2, 51, '2658000000000000000d57')
30-08-2013 09:51:15	nuevo tag para lectura 2
30-08-2013 09:51:18	SELECT f_almacena_lectura(0, 0, 0, '2013-08-30 09:51:18', 2, 47, '2658000000000000000d57')
30-08-2013 09:51:20	SELECT f_almacena_lectura(0, 0, 1, '2013-08-30 09:51:20', 2, 51, '2658000000000000000d57')
30-08-2013 09:51:23	SELECT f_almacena_lectura(0, 0, 0, '2013-08-30 09:51:23', 2, 51, '2658000000000000000d57')
30-08-2013 09:51:23	SELECT f_almacena_lectura(0, 0, 1, '2013-08-30 09:51:23', 2, 47, '2658000000000000000d57')
30-08-2013 09:51:26	SELECT f_almacena_lectura(0, 0, 0, '2013-08-30 09:51:26', 2, 47, '2658000000000000000d57')
30-08-2013 09:51:28	SELECT f_almacena_lectura(0, 0, 1, '2013-08-30 09:51:28', 2, 51, '2658000000000000000d57')
30-08-2013 09:51:32	SELECT f_almacena_lectura(0, 0, 1, '2013-08-30 09:51:32', 2, 47, '2658000000000000000d57')
30-08-2013 09:51:56	SELECT f_almacena_lectura(0, 0, 0, '2013-08-30 09:51:56', 2, 51, '2658000000000000000d57')
30-08-2013 09:51:58	SELECT f_almacena_lectura(0, 0, 0, '2013-08-30 09:51:58', 2, 47, '2658000000000000000d57')
30-08-2013 09:52:01	SELECT f_almacena_lectura(0, 0, 1, '2013-08-30 09:52:01', 2, 51, '2658000000000000000d57')
30-08-2013 09:52:02	SELECT f_almacena_lectura(0, 0, 0, '2013-08-30 09:52:02', 2, 51, '466536000000000000000000')
30-08-2013 09:52:03	SELECT f_almacena_lectura(0, 0, 1, '2013-08-30 09:52:03', 2, 47, '2658000000000000000d57')
30-08-2013 09:52:07	SELECT f_almacena_lectura(0, 0, 0, '2013-08-30 09:52:07', 2, 47, '466536000000000000000000')
30-08-2013 09:52:11	SELECT f_almacena_lectura(0, 0, 1, '2013-08-30 09:52:11', 2, 51, '466536000000000000000000')
30-08-2013 09:52:12	SELECT f_almacena_lectura(0, 0, 1, '2013-08-30 09:52:12', 2, 47, '466536000000000000000000')
30-08-2013 09:52:53	SELECT f_almacena_lectura(0, 0, 0, '2013-08-30 09:52:53', 2, 51, '2658000000000000000d57')
30-08-2013 09:52:53	nuevo tag para lectura 4
30-08-2013 09:52:55	SELECT f_almacena_lectura(0, 0, 0, '2013-08-30 09:52:55', 2, 47, '2658000000000000000d57')
30-08-2013 09:52:55	nuevo tag para lectura 4
30-08-2013 09:52:58	SELECT f_almacena_lectura(0, 0, 1, '2013-08-30 09:52:58', 2, 51, '2658000000000000000d57')
30-08-2013 09:53:00	SELECT f_almacena_lectura(0, 0, 1, '2013-08-30 09:53:00', 2, 47, '2658000000000000000d57')
30-08-2013 11:36:29	SELECT f_almacena_lectura(0, 0, 0, '2013-08-30 11:36:29', 0, 51, 'null')
30-08-2013 11:36:31	SELECT f_almacena_lectura(0, 0, 0, '2013-08-30 11:36:31', 0, 47, 'null')
30-08-2013 11:36:35	SELECT f_almacena_lectura(0, 0, 1, '2013-08-30 11:36:35', 0, 51, 'null')
30-08-2013 11:36:37	SELECT f_almacena_lectura(0, 0, 1, '2013-08-30 11:36:37', 0, 47, 'null')
30-08-2013 11:37:55	SELECT f_almacena_lectura(0, 0, 0, '2013-08-30 11:37:55', 2, 51, '2658000000000000000d57')
30-08-2013 11:37:55	nuevo tag para lectura 2
30-08-2013 11:37:58	SELECT f_almacena_lectura(0, 0, 0, '2013-08-30 11:37:58', 2, 47, '2658000000000000000d57')
30-08-2013 11:37:58	nuevo tag para lectura 2
30-08-2013 11:38:00	SELECT f_almacena_lectura(0, 0, 1, '2013-08-30 11:38:00', 2, 51, '2658000000000000000d57')
30-08-2013 11:38:04	SELECT f_almacena_lectura(0, 0, 1, '2013-08-30 11:38:04', 2, 47, '2658000000000000000d57')
30-08-2013 11:38:11	SELECT f_almacena_lectura(0, 0, 0, '2013-08-30 11:38:11', 0, 51, 'null')
30-08-2013 11:38:14	SELECT f_almacena_lectura(0, 0, 0, '2013-08-30 11:38:14', 0, 47, 'null')
30-08-2013 11:38:17	SELECT f_almacena_lectura(0, 0, 1, '2013-08-30 11:38:17', 0, 51, 'null')
30-08-2013 11:38:19	SELECT f_almacena_lectura(0, 0, 1, '2013-08-30 11:38:19', 0, 47, 'null')
30-08-2013 11:49:20	SELECT f_almacena_lectura(0, 0, 0, '2013-08-30 11:49:20', 2, 51, '2658000000000000000d57')
30-08-2013 11:49:22	SELECT f_almacena_lectura(0, 0, 0, '2013-08-30 11:49:22', 2, 47, '2658000000000000000d57')
30-08-2013 11:49:25	SELECT f_almacena_lectura(0, 0, 1, '2013-08-30 11:49:25', 2, 51, '2658000000000000000d57')
30-08-2013 11:49:28	SELECT f_almacena_lectura(0, 0, 1, '2013-08-30 11:49:28', 2, 47, '2658000000000000000d57')
30-08-2013 11:49:34	SELECT f_almacena_lectura(0, 0, 0, '2013-08-30 11:49:34', 2, 51, '2658000000000000000d57')
30-08-2013 11:49:34	nuevo tag para lectura 2
30-08-2013 11:49:35	SELECT f_almacena_lectura(0, 0, 0, '2013-08-30 11:49:35', 2, 47, '2658000000000000000d57')
30-08-2013 11:49:36	nuevo tag para lectura 2
30-08-2013 11:49:39	SELECT f_almacena_lectura(0, 0, 1, '2013-08-30 11:49:39', 2, 51, '2658000000000000000d57')
30-08-2013 11:49:41	SELECT f_almacena_lectura(0, 0, 1, '2013-08-30 11:49:41', 2, 47, '2658000000000000000d57')
30-08-2013 04:35:03	SELECT f_almacena_lectura(0, 0, 0, '2013-08-30 16:35:03', 2, 51, '466536000000000000000000')
30-08-2013 04:35:03	nuevo tag para lectura 2
30-08-2013 04:35:06	SELECT f_almacena_lectura(0, 0, 0, '2013-08-30 16:35:06', 2, 47, '466536000000000000000000')
30-08-2013 04:35:06	nuevo tag para lectura 2
30-08-2013 04:35:09	SELECT f_almacena_lectura(0, 0, 1, '2013-08-30 16:35:09', 2, 51, '466536000000000000000000')
30-08-2013 04:35:11	SELECT f_almacena_lectura(0, 0, 1, '2013-08-30 16:35:11', 2, 47, '466536000000000000000000')
30-08-2013 04:35:13	SELECT f_almacena_lectura(0, 0, 0, '2013-08-30 16:35:13', 2, 51, '466536000000000000000000')
30-08-2013 04:35:15	SELECT f_almacena_lectura(0, 0, 0, '2013-08-30 16:35:15', 2, 47, '466536000000000000000000')
30-08-2013 04:35:16	SELECT f_almacena_lectura(0, 0, 0, '2013-08-30 16:35:16', 2, 47, '445988000000000000080e')
30-08-2013 04:35:16	nuevo tag para lectura 2
30-08-2013 04:35:19	SELECT f_almacena_lectura(0, 0, 1, '2013-08-30 16:35:19', 2, 51, '466536000000000000000000')
30-08-2013 04:35:22	SELECT f_almacena_lectura(0, 0, 1, '2013-08-30 16:35:22', 2, 47, '445988000000000000080e')
30-08-2013 04:35:22	SELECT f_almacena_lectura(0, 0, 1, '2013-08-30 16:35:22', 2, 47, '466536000000000000000000')
30-08-2013 04:35:24	SELECT f_almacena_lectura(0, 0, 0, '2013-08-30 16:35:24', 2, 47, '466536000000000000000000')
30-08-2013 04:35:32	SELECT f_almacena_lectura(0, 0, 1, '2013-08-30 16:35:32', 2, 47, '466536000000000000000000')
30-08-2013 04:35:36	SELECT f_almacena_lectura(0, 0, 0, '2013-08-30 16:35:36', 2, 51, '466536000000000000000000')
30-08-2013 04:35:46	SELECT f_almacena_lectura(0, 0, 1, '2013-08-30 16:35:46', 2, 51, '466536000000000000000000')
03-09-2013 09:54:54	SELECT f_almacena_lectura(0, 0, 0, '2013-09-03 09:54:54', 2, 47, '2658000000000000000d57')
03-09-2013 09:54:54	SELECT f_almacena_lectura(0, 0, 0, '2013-09-03 09:54:54', 2, 47, '2658000000000000000d57')
03-09-2013 09:55:00	SELECT f_almacena_lectura(0, 0, 1, '2013-09-03 09:55:00', 2, 47, '2658000000000000000d57')
03-09-2013 09:55:00	SELECT f_almacena_lectura(0, 0, 1, '2013-09-03 09:55:00', 2, 47, '2658000000000000000d57')
03-09-2013 09:56:03	SELECT f_almacena_lectura(0, 0, 0, '2013-09-03 09:56:03', 2, 47, '2658000000000000000d57')
03-09-2013 09:56:03	SELECT f_almacena_lectura(0, 0, 0, '2013-09-03 09:56:03', 2, 47, '2658000000000000000d57')
03-09-2013 09:56:09	SELECT f_almacena_lectura(0, 0, 1, '2013-09-03 09:56:09', 2, 47, '2658000000000000000d57')
03-09-2013 09:56:09	SELECT f_almacena_lectura(0, 0, 1, '2013-09-03 09:56:09', 2, 47, '2658000000000000000d57')
03-09-2013 09:57:30	SELECT f_almacena_lectura(0, 0, 0, '2013-09-03 09:57:30', 2, 47, '1936000000000000001e75')
03-09-2013 09:57:30	SELECT f_almacena_lectura(0, 0, 0, '2013-09-03 09:57:30', 2, 47, '1936000000000000001e75') ERROR: query string argument of EXECUTE is null
  Where: PL/pgSQL function "f_almacena_lectura" line 85 at EXECUTE statement
03-09-2013 09:57:36	SELECT f_almacena_lectura(0, 0, 1, '2013-09-03 09:57:36', 2, 47, '1936000000000000001e75')
03-09-2013 09:57:39	SELECT f_almacena_lectura(0, 0, 1, '2013-09-03 09:57:36', 2, 47, '1936000000000000001e75') ERROR: query string argument of EXECUTE is null
  Where: PL/pgSQL function "f_almacena_lectura" line 85 at EXECUTE statement
03-09-2013 09:57:47	SELECT f_almacena_lectura(0, 0, 0, '2013-09-03 09:57:47', 2, 47, '1936000000000000005f0a')
03-09-2013 09:57:47	SELECT f_almacena_lectura(0, 0, 0, '2013-09-03 09:57:47', 2, 47, '1936000000000000005f0a') ERROR: query string argument of EXECUTE is null
  Where: PL/pgSQL function "f_almacena_lectura" line 85 at EXECUTE statement
03-09-2013 09:57:52	SELECT f_almacena_lectura(0, 0, 1, '2013-09-03 09:57:52', 2, 47, '1936000000000000005f0a')
03-09-2013 09:57:52	SELECT f_almacena_lectura(0, 0, 1, '2013-09-03 09:57:52', 2, 47, '1936000000000000005f0a') ERROR: query string argument of EXECUTE is null
  Where: PL/pgSQL function "f_almacena_lectura" line 85 at EXECUTE statement
03-09-2013 09:57:55	SELECT f_almacena_lectura(0, 0, 0, '2013-09-03 09:57:55', 2, 47, '1936000000000000001e47')
03-09-2013 09:57:55	SELECT f_almacena_lectura(0, 0, 0, '2013-09-03 09:57:55', 2, 47, '1936000000000000001e47') ERROR: query string argument of EXECUTE is null
  Where: PL/pgSQL function "f_almacena_lectura" line 85 at EXECUTE statement
03-09-2013 09:57:58	SELECT f_almacena_lectura(0, 0, 0, '2013-09-03 09:57:58', 2, 47, '1936000000000000001d83')
03-09-2013 09:57:58	SELECT f_almacena_lectura(0, 0, 0, '2013-09-03 09:57:58', 2, 47, '1936000000000000001d83') ERROR: query string argument of EXECUTE is null
  Where: PL/pgSQL function "f_almacena_lectura" line 85 at EXECUTE statement
03-09-2013 09:58:00	SELECT f_almacena_lectura(0, 0, 1, '2013-09-03 09:58:00', 2, 47, '1936000000000000001e47')
03-09-2013 09:58:00	SELECT f_almacena_lectura(0, 0, 1, '2013-09-03 09:58:00', 2, 47, '1936000000000000001e47') ERROR: query string argument of EXECUTE is null
  Where: PL/pgSQL function "f_almacena_lectura" line 85 at EXECUTE statement
03-09-2013 09:58:02	SELECT f_almacena_lectura(0, 0, 0, '2013-09-03 09:58:02', 2, 47, '1936000000000000001ec3')
03-09-2013 09:58:02	SELECT f_almacena_lectura(0, 0, 0, '2013-09-03 09:58:02', 2, 47, '1936000000000000001ec3') ERROR: query string argument of EXECUTE is null
  Where: PL/pgSQL function "f_almacena_lectura" line 85 at EXECUTE statement
03-09-2013 09:58:04	SELECT f_almacena_lectura(0, 0, 1, '2013-09-03 09:58:04', 2, 47, '1936000000000000001d83')
03-09-2013 09:58:04	SELECT f_almacena_lectura(0, 0, 1, '2013-09-03 09:58:04', 2, 47, '1936000000000000001d83') ERROR: query string argument of EXECUTE is null
  Where: PL/pgSQL function "f_almacena_lectura" line 85 at EXECUTE statement
03-09-2013 09:58:07	SELECT f_almacena_lectura(0, 0, 1, '2013-09-03 09:58:07', 2, 47, '1936000000000000001ec3')
03-09-2013 09:58:07	SELECT f_almacena_lectura(0, 0, 1, '2013-09-03 09:58:07', 2, 47, '1936000000000000001ec3') ERROR: query string argument of EXECUTE is null
  Where: PL/pgSQL function "f_almacena_lectura" line 85 at EXECUTE statement
03-09-2013 09:58:58	SELECT f_almacena_lectura(0, 0, 0, '2013-09-03 09:58:58', 2, 47, '0127000000000000001b9a')
03-09-2013 09:59:01	SELECT f_almacena_lectura(0, 0, 0, '2013-09-03 09:59:01', 2, 47, '0127000000000000001bfe')
03-09-2013 09:59:03	SELECT f_almacena_lectura(0, 0, 1, '2013-09-03 09:59:03', 2, 47, '0127000000000000001b9a')
03-09-2013 09:59:06	SELECT f_almacena_lectura(0, 0, 0, '2013-09-03 09:59:06', 2, 47, '0127000000000000001c00')
03-09-2013 09:59:06	SELECT f_almacena_lectura(0, 0, 1, '2013-09-03 09:59:06', 2, 47, '0127000000000000001bfe')
03-09-2013 09:59:09	SELECT f_almacena_lectura(0, 0, 0, '2013-09-03 09:59:09', 2, 47, '0127000000000000001b5e')
03-09-2013 09:59:11	SELECT f_almacena_lectura(0, 0, 0, '2013-09-03 09:59:11', 2, 47, '0127000000000000001b62')
03-09-2013 09:59:11	SELECT f_almacena_lectura(0, 0, 1, '2013-09-03 09:59:11', 2, 47, '0127000000000000001c00')
03-09-2013 09:59:14	SELECT f_almacena_lectura(0, 0, 1, '2013-09-03 09:59:14', 2, 47, '0127000000000000001b5e')
03-09-2013 09:59:16	SELECT f_almacena_lectura(0, 0, 1, '2013-09-03 09:59:16', 2, 47, '0127000000000000001b62')
03-09-2013 09:59:33	SELECT f_almacena_lectura(0, 0, 0, '2013-09-03 09:59:33', 2, 47, '372d055bfca26487b78f47011078')
03-09-2013 09:59:41	SELECT f_almacena_lectura(0, 0, 1, '2013-09-03 09:59:41', 2, 47, '372d055bfca26487b78f47011078')
03-09-2013 09:59:59	SELECT f_almacena_lectura(0, 0, 0, '2013-09-03 09:59:59', 2, 47, '3005fb63ac1f3841ec880467')
03-09-2013 09:59:59	SELECT f_almacena_lectura(0, 0, 0, '2013-09-03 09:59:59', 2, 47, 'a001fb63ac1f3841ec880467')
03-09-2013 10:00:25	SELECT f_almacena_lectura(0, 0, 0, '2013-09-03 10:00:25', 2, 47, '79000000000000000fec')
03-09-2013 10:00:30	SELECT f_almacena_lectura(0, 0, 1, '2013-09-03 10:00:30', 2, 47, '79000000000000000fec')
03-09-2013 10:00:46	SELECT f_almacena_lectura(0, 0, 1, '2013-09-03 10:00:46', 2, 47, '3005fb63ac1f3841ec880467')
03-09-2013 10:00:46	SELECT f_almacena_lectura(0, 0, 1, '2013-09-03 10:00:46', 2, 47, 'a001fb63ac1f3841ec880467')
03-09-2013 10:01:07	SELECT f_almacena_lectura(0, 0, 0, '2013-09-03 10:01:07', 2, 47, '466536000000000000000000')
03-09-2013 10:01:13	SELECT f_almacena_lectura(0, 0, 1, '2013-09-03 10:01:13', 2, 47, '466536000000000000000000')
03-09-2013 10:01:31	SELECT f_almacena_lectura(0, 0, 0, '2013-09-03 10:01:31', 2, 47, '300833b2ddd9bd0500da559c')
03-09-2013 10:01:36	SELECT f_almacena_lectura(0, 0, 1, '2013-09-03 10:01:36', 2, 47, '300833b2ddd9bd0500da559c')
03-09-2013 10:01:37	SELECT f_almacena_lectura(0, 0, 0, '2013-09-03 10:01:37', 2, 47, '300833b2ddd9bd0700014af4')
03-09-2013 10:01:41	SELECT f_almacena_lectura(0, 0, 0, '2013-09-03 10:01:41', 2, 47, '300833b2ddd9014000000000')
03-09-2013 10:01:43	SELECT f_almacena_lectura(0, 0, 1, '2013-09-03 10:01:43', 2, 47, '300833b2ddd9bd0700014af4')
03-09-2013 10:01:47	SELECT f_almacena_lectura(0, 0, 1, '2013-09-03 10:01:47', 2, 47, '300833b2ddd9014000000000')
03-09-2013 10:01:47	SELECT f_almacena_lectura(0, 0, 0, '2013-09-03 10:01:47', 2, 47, '300833b2ddd9bd0500d6f547')
03-09-2013 10:01:50	SELECT f_almacena_lectura(0, 0, 0, '2013-09-03 10:01:50', 2, 47, '300833b2ddd9bd0400bb97ff')
03-09-2013 10:01:53	SELECT f_almacena_lectura(0, 0, 1, '2013-09-03 10:01:53', 2, 47, '300833b2ddd9bd0500d6f547')
03-09-2013 10:01:54	SELECT f_almacena_lectura(0, 0, 0, '2013-09-03 10:01:54', 2, 47, '300833b2ddd9014000000000')
03-09-2013 10:01:55	SELECT f_almacena_lectura(0, 0, 1, '2013-09-03 10:01:55', 2, 47, '300833b2ddd9bd0400bb97ff')
03-09-2013 10:01:59	SELECT f_almacena_lectura(0, 0, 1, '2013-09-03 10:01:59', 2, 47, '300833b2ddd9014000000000')
03-09-2013 10:02:00	SELECT f_almacena_lectura(0, 0, 0, '2013-09-03 10:02:00', 2, 47, 'e2801130200020c3db8b00ab')
03-09-2013 10:02:05	SELECT f_almacena_lectura(0, 0, 0, '2013-09-03 10:02:05', 2, 47, '3005fb63ac1f3841ec880469')
03-09-2013 10:02:06	SELECT f_almacena_lectura(0, 0, 1, '2013-09-03 10:02:06', 2, 47, 'e2801130200020c3db8b00ab')
03-09-2013 10:02:11	SELECT f_almacena_lectura(0, 0, 1, '2013-09-03 10:02:11', 2, 47, '3005fb63ac1f3841ec880469')
03-09-2013 10:02:17	SELECT f_almacena_lectura(0, 0, 0, '2013-09-03 10:02:17', 2, 47, '2658000000000000000e08')
03-09-2013 10:02:20	SELECT f_almacena_lectura(0, 0, 0, '2013-09-03 10:02:20', 2, 47, '01260000000000000011e0')
03-09-2013 10:02:23	SELECT f_almacena_lectura(0, 0, 1, '2013-09-03 10:02:23', 2, 47, '2658000000000000000e08')
03-09-2013 10:02:23	SELECT f_almacena_lectura(0, 0, 0, '2013-09-03 10:02:23', 2, 47, '0214000000000000000706')
03-09-2013 10:02:26	SELECT f_almacena_lectura(0, 0, 1, '2013-09-03 10:02:26', 2, 47, '01260000000000000011e0')
03-09-2013 10:02:26	SELECT f_almacena_lectura(0, 0, 0, '2013-09-03 10:02:26', 2, 47, '0214000000000000000707')
03-09-2013 10:02:29	SELECT f_almacena_lectura(0, 0, 1, '2013-09-03 10:02:29', 2, 47, '0214000000000000000706')
03-09-2013 10:02:29	SELECT f_almacena_lectura(0, 0, 0, '2013-09-03 10:02:29', 2, 47, '01260000000000000012e0')
03-09-2013 10:02:32	SELECT f_almacena_lectura(0, 0, 1, '2013-09-03 10:02:32', 2, 47, '0214000000000000000707')
03-09-2013 10:02:36	SELECT f_almacena_lectura(0, 0, 1, '2013-09-03 10:02:36', 2, 47, '01260000000000000012e0')
03-09-2013 10:02:43	SELECT f_almacena_lectura(0, 0, 0, '2013-09-03 10:02:43', 2, 47, '0126000000000000001208')
03-09-2013 10:02:52	SELECT f_almacena_lectura(0, 0, 1, '2013-09-03 10:02:52', 2, 47, '0126000000000000001208')
03-09-2013 10:03:17	SELECT f_almacena_lectura(0, 0, 0, '2013-09-03 10:03:17', 2, 47, '0503191276000000000078c0')
03-09-2013 10:03:21	SELECT f_almacena_lectura(0, 0, 0, '2013-09-03 10:03:21', 2, 47, '0503191276000000000078d4')
03-09-2013 10:03:22	SELECT f_almacena_lectura(0, 0, 1, '2013-09-03 10:03:22', 2, 47, '0503191276000000000078c0')
03-09-2013 10:03:26	SELECT f_almacena_lectura(0, 0, 0, '2013-09-03 10:03:26', 2, 47, '201212018447010001010177')
03-09-2013 10:03:27	SELECT f_almacena_lectura(0, 0, 1, '2013-09-03 10:03:27', 2, 47, '0503191276000000000078d4')
03-09-2013 10:03:33	SELECT f_almacena_lectura(0, 0, 1, '2013-09-03 10:03:33', 2, 47, '201212018447010001010177')
03-09-2013 10:03:33	SELECT f_almacena_lectura(0, 0, 0, '2013-09-03 10:03:33', 2, 47, '2658000000000000000be6')
03-09-2013 10:03:37	SELECT f_almacena_lectura(0, 0, 0, '2013-09-03 10:03:37', 2, 47, '2658000000000000000e0d')
03-09-2013 10:03:39	SELECT f_almacena_lectura(0, 0, 1, '2013-09-03 10:03:39', 2, 47, '2658000000000000000be6')
03-09-2013 10:03:40	SELECT f_almacena_lectura(0, 0, 0, '2013-09-03 10:03:40', 2, 47, '2667000000100000000df2')
03-09-2013 10:03:43	SELECT f_almacena_lectura(0, 0, 1, '2013-09-03 10:03:43', 2, 47, '2658000000000000000e0d')
03-09-2013 10:03:48	SELECT f_almacena_lectura(0, 0, 1, '2013-09-03 10:03:48', 2, 47, '2667000000100000000df2')
03-09-2013 10:03:48	SELECT f_almacena_lectura(0, 0, 0, '2013-09-03 10:03:48', 2, 47, '2013032085100300010400d0')
03-09-2013 10:03:56	SELECT f_almacena_lectura(0, 0, 1, '2013-09-03 10:03:56', 2, 47, '2013032085100300010400d0')
03-09-2013 10:04:16	SELECT f_almacena_lectura(0, 0, 0, '2013-09-03 10:04:16', 2, 47, '79000000000000000fca')
03-09-2013 10:04:20	SELECT f_almacena_lectura(0, 0, 0, '2013-09-03 10:04:20', 2, 47, '79000000000000001015')
03-09-2013 10:04:22	SELECT f_almacena_lectura(0, 0, 1, '2013-09-03 10:04:22', 2, 47, '79000000000000000fca')
03-09-2013 10:04:26	SELECT f_almacena_lectura(0, 0, 1, '2013-09-03 10:04:26', 2, 47, '79000000000000001015')
03-09-2013 10:04:28	SELECT f_almacena_lectura(0, 0, 0, '2013-09-03 10:04:28', 2, 47, '79000000000000000fec')
03-09-2013 10:04:32	SELECT f_almacena_lectura(0, 0, 0, '2013-09-03 10:04:32', 2, 47, '79000000000000000fa8')
03-09-2013 10:04:34	SELECT f_almacena_lectura(0, 0, 1, '2013-09-03 10:04:34', 2, 47, '79000000000000000fec')
03-09-2013 10:04:38	SELECT f_almacena_lectura(0, 0, 0, '2013-09-03 10:04:38', 2, 47, '79000000000000000fd6')
03-09-2013 10:04:40	SELECT f_almacena_lectura(0, 0, 1, '2013-09-03 10:04:40', 2, 47, '79000000000000000fa8')
03-09-2013 10:04:44	SELECT f_almacena_lectura(0, 0, 1, '2013-09-03 10:04:44', 2, 47, '79000000000000000fd6')
03-09-2013 10:04:58	SELECT f_almacena_lectura(0, 0, 0, '2013-09-03 10:04:58', 2, 47, '0503191276000000000078c1')
03-09-2013 10:05:05	SELECT f_almacena_lectura(0, 0, 1, '2013-09-03 10:05:05', 2, 47, '0503191276000000000078c1')
03-09-2013 10:05:53	SELECT f_almacena_lectura(0, 0, 0, '2013-09-03 10:05:53', 2, 47, '445900000000000000023d')
03-09-2013 10:05:58	SELECT f_almacena_lectura(0, 0, 1, '2013-09-03 10:05:58', 2, 47, '445900000000000000023d')
03-09-2013 10:05:59	SELECT f_almacena_lectura(0, 0, 0, '2013-09-03 10:05:59', 2, 47, '445900000000000000025b')
03-09-2013 10:06:02	SELECT f_almacena_lectura(0, 0, 0, '2013-09-03 10:06:02', 2, 47, '44590000000000000002cc')
03-09-2013 10:06:05	SELECT f_almacena_lectura(0, 0, 1, '2013-09-03 10:06:05', 2, 47, '445900000000000000025b')
03-09-2013 10:06:07	SELECT f_almacena_lectura(0, 0, 1, '2013-09-03 10:06:07', 2, 47, '44590000000000000002cc')
03-09-2013 10:06:09	SELECT f_almacena_lectura(0, 0, 0, '2013-09-03 10:06:09', 2, 47, '217400000000000000442c')
03-09-2013 10:06:15	SELECT f_almacena_lectura(0, 0, 1, '2013-09-03 10:06:15', 2, 47, '217400000000000000442c')
03-09-2013 10:06:29	SELECT f_almacena_lectura(0, 0, 0, '2013-09-03 10:06:29', 2, 47, 'e2002062610d01730880bd8d')
03-09-2013 10:06:30	SELECT f_almacena_lectura(0, 0, 0, '2013-09-03 10:06:30', 2, 47, 'e2002062610d01730920b981')
03-09-2013 10:06:32	SELECT f_almacena_lectura(0, 0, 0, '2013-09-03 10:06:32', 2, 47, 'e2002062610d01730960b569')
03-09-2013 10:06:33	SELECT f_almacena_lectura(0, 0, 0, '2013-09-03 10:06:33', 2, 47, 'e2002062610d01730680d0c5')
03-09-2013 10:06:35	SELECT f_almacena_lectura(0, 0, 0, '2013-09-03 10:06:35', 2, 47, 'e2002062610d01730720cd15')
03-09-2013 10:06:35	SELECT f_almacena_lectura(0, 0, 1, '2013-09-03 10:06:35', 2, 47, 'e2002062610d01730880bd8d')
03-09-2013 10:06:38	SELECT f_almacena_lectura(0, 0, 0, '2013-09-03 10:06:38', 2, 47, 'e2002062610d01730880bd8d')
03-09-2013 10:06:40	SELECT f_almacena_lectura(0, 0, 1, '2013-09-03 10:06:40', 2, 47, 'e2002062610d01730720cd15')
03-09-2013 10:06:40	SELECT f_almacena_lectura(0, 0, 0, '2013-09-03 10:06:40', 2, 47, 'e2002062610d01730720cd15')
03-09-2013 10:06:51	SELECT f_almacena_lectura(0, 0, 1, '2013-09-03 10:06:51', 2, 47, 'e2002062610d01730720cd15')
03-09-2013 10:06:53	SELECT f_almacena_lectura(0, 0, 1, '2013-09-03 10:06:53', 2, 47, 'e2002062610d01730680d0c5')
03-09-2013 10:06:53	SELECT f_almacena_lectura(0, 0, 1, '2013-09-03 10:06:53', 2, 47, 'e2002062610d01730920b981')
03-09-2013 10:06:53	SELECT f_almacena_lectura(0, 0, 1, '2013-09-03 10:06:53', 2, 47, 'e2002062610d01730880bd8d')
03-09-2013 10:06:54	SELECT f_almacena_lectura(0, 0, 1, '2013-09-03 10:06:54', 2, 47, 'e2002062610d01730960b569')
03-09-2013 10:07:38	SELECT f_almacena_lectura(0, 0, 0, '2013-09-03 10:07:38', 2, 47, 'e20020626204018622702d74')
03-09-2013 10:07:38	SELECT f_almacena_lectura(0, 0, 0, '2013-09-03 10:07:38', 2, 47, 'e200206262040186230029bb')
03-09-2013 10:07:39	SELECT f_almacena_lectura(0, 0, 0, '2013-09-03 10:07:39', 2, 47, 'e20020626204018623302612')
03-09-2013 10:07:40	SELECT f_almacena_lectura(0, 0, 0, '2013-09-03 10:07:40', 2, 47, 'e20020626204018623702282')
03-09-2013 10:07:41	SELECT f_almacena_lectura(0, 0, 0, '2013-09-03 10:07:41', 2, 47, 'e20020626204018624001f09')
03-09-2013 10:07:51	SELECT f_almacena_lectura(0, 0, 1, '2013-09-03 10:07:51', 2, 47, 'e20020626204018624001f09')
03-09-2013 10:07:52	SELECT f_almacena_lectura(0, 0, 1, '2013-09-03 10:07:52', 2, 47, 'e20020626204018623302612')
03-09-2013 10:07:52	SELECT f_almacena_lectura(0, 0, 1, '2013-09-03 10:07:52', 2, 47, 'e200206262040186230029bb')
03-09-2013 10:07:52	SELECT f_almacena_lectura(0, 0, 1, '2013-09-03 10:07:52', 2, 47, 'e20020626204018622702d74')
03-09-2013 10:07:52	SELECT f_almacena_lectura(0, 0, 1, '2013-09-03 10:07:52', 2, 47, 'e20020626204018623702282')
03-09-2013 12:07:01	SELECT f_almacena_lectura(0, 0, 0, '2013-09-03 12:07:01', 2, 47, '0127000000000000001b9a')
03-09-2013 12:07:07	SELECT f_almacena_lectura(0, 0, 1, '2013-09-03 12:07:07', 2, 47, '0127000000000000001b9a')
03-09-2013 12:08:06	SELECT f_almacena_lectura(0, 0, 0, '2013-09-03 12:08:06', 2, 51, '1936000000000000001e75')
03-09-2013 12:08:06	SELECT f_almacena_lectura(2, 0, 2, '2013-09-03 12:08:06', 2, 51, '1936000000000000001e75')
03-09-2013 12:08:10	SELECT f_almacena_lectura(0, 0, 0, '2013-09-03 12:08:10', 2, 51, '1936000000000000001d83')
03-09-2013 12:08:10	SELECT f_almacena_lectura(2, 0, 2, '2013-09-03 12:08:10', 2, 51, '1936000000000000001d83')
03-09-2013 12:08:12	SELECT f_almacena_lectura(0, 0, 1, '2013-09-03 12:08:12', 2, 51, '1936000000000000001e75')
03-09-2013 12:08:14	SELECT f_almacena_lectura(0, 0, 0, '2013-09-03 12:08:14', 2, 51, '1936000000000000001ec3')
03-09-2013 12:08:14	SELECT f_almacena_lectura(2, 0, 2, '2013-09-03 12:08:14', 2, 51, '1936000000000000001ec3')
03-09-2013 12:08:16	SELECT f_almacena_lectura(0, 0, 1, '2013-09-03 12:08:16', 2, 51, '1936000000000000001d83')
03-09-2013 12:08:17	SELECT f_almacena_lectura(0, 0, 0, '2013-09-03 12:08:17', 2, 51, '1936000000000000005f0a')
03-09-2013 12:08:17	SELECT f_almacena_lectura(2, 0, 2, '2013-09-03 12:08:17', 2, 51, '1936000000000000005f0a')
03-09-2013 12:08:19	SELECT f_almacena_lectura(0, 0, 1, '2013-09-03 12:08:19', 2, 51, '1936000000000000001ec3')
03-09-2013 12:08:20	SELECT f_almacena_lectura(0, 0, 0, '2013-09-03 12:08:20', 2, 51, '1936000000000000001e47')
03-09-2013 12:08:20	SELECT f_almacena_lectura(2, 0, 2, '2013-09-03 12:08:20', 2, 51, '1936000000000000001e47')
03-09-2013 12:08:22	SELECT f_almacena_lectura(0, 0, 1, '2013-09-03 12:08:22', 2, 51, '1936000000000000005f0a')
03-09-2013 12:08:25	SELECT f_almacena_lectura(0, 0, 1, '2013-09-03 12:08:25', 2, 51, '1936000000000000001e47')
03-09-2013 12:09:51	SELECT f_almacena_lectura(0, 0, 0, '2013-09-03 12:09:51', 2, 51, '0127000000000000001b9a')
03-09-2013 12:09:51	SELECT f_almacena_lectura(2, 0, 2, '2013-09-03 12:09:51', 2, 51, '0127000000000000001b9a')
03-09-2013 12:09:54	SELECT f_almacena_lectura(0, 0, 0, '2013-09-03 12:09:54', 2, 51, '0127000000000000001b5e')
03-09-2013 12:09:54	SELECT f_almacena_lectura(2, 0, 2, '2013-09-03 12:09:54', 2, 51, '0127000000000000001b5e')
03-09-2013 12:09:57	SELECT f_almacena_lectura(0, 0, 1, '2013-09-03 12:09:57', 2, 51, '0127000000000000001b9a')
03-09-2013 12:09:57	SELECT f_almacena_lectura(0, 0, 0, '2013-09-03 12:09:57', 2, 51, '0127000000000000001bfe')
03-09-2013 12:09:57	SELECT f_almacena_lectura(2, 0, 2, '2013-09-03 12:09:57', 2, 51, '0127000000000000001bfe')
03-09-2013 12:10:00	SELECT f_almacena_lectura(0, 0, 1, '2013-09-03 12:10:00', 2, 51, '0127000000000000001b5e')
03-09-2013 12:10:00	SELECT f_almacena_lectura(0, 0, 0, '2013-09-03 12:10:00', 2, 51, '0127000000000000001b62')
03-09-2013 12:10:00	SELECT f_almacena_lectura(2, 0, 2, '2013-09-03 12:10:00', 2, 51, '0127000000000000001b62')
03-09-2013 12:10:03	SELECT f_almacena_lectura(0, 0, 1, '2013-09-03 12:10:03', 2, 51, '0127000000000000001bfe')
03-09-2013 12:10:04	SELECT f_almacena_lectura(0, 0, 0, '2013-09-03 12:10:04', 2, 51, '0127000000000000001c00')
03-09-2013 12:10:04	SELECT f_almacena_lectura(2, 0, 2, '2013-09-03 12:10:04', 2, 51, '0127000000000000001c00')
03-09-2013 12:10:06	SELECT f_almacena_lectura(0, 0, 1, '2013-09-03 12:10:06', 2, 51, '0127000000000000001b62')
03-09-2013 12:10:10	SELECT f_almacena_lectura(0, 0, 1, '2013-09-03 12:10:10', 2, 51, '0127000000000000001c00')
03-09-2013 12:11:27	SELECT f_almacena_lectura(0, 0, 0, '2013-09-03 12:11:27', 2, 51, '2658000000000000000d57')
03-09-2013 12:11:27	SELECT f_almacena_lectura(2, 0, 2, '2013-09-03 12:11:27', 2, 51, '2658000000000000000d57')
03-09-2013 12:11:29	SELECT f_almacena_lectura(0, 0, 0, '2013-09-03 12:11:29', 2, 51, '2658000000000000000e08')
03-09-2013 12:11:29	SELECT f_almacena_lectura(2, 0, 2, '2013-09-03 12:11:29', 2, 51, '2658000000000000000e08')
03-09-2013 12:11:31	SELECT f_almacena_lectura(0, 0, 0, '2013-09-03 12:11:31', 2, 51, '2658000000000000000be6')
03-09-2013 12:11:31	SELECT f_almacena_lectura(2, 0, 2, '2013-09-03 12:11:31', 2, 51, '2658000000000000000be6')
03-09-2013 12:11:33	SELECT f_almacena_lectura(0, 0, 1, '2013-09-03 12:11:33', 2, 51, '2658000000000000000d57')
03-09-2013 12:11:34	SELECT f_almacena_lectura(0, 0, 0, '2013-09-03 12:11:34', 2, 51, '2658000000000000000e0d')
03-09-2013 12:11:34	SELECT f_almacena_lectura(2, 0, 2, '2013-09-03 12:11:34', 2, 51, '2658000000000000000e0d')
03-09-2013 12:11:35	SELECT f_almacena_lectura(0, 0, 1, '2013-09-03 12:11:35', 2, 51, '2658000000000000000e08')
03-09-2013 12:11:35	SELECT f_almacena_lectura(0, 0, 0, '2013-09-03 12:11:35', 2, 51, '2667000000100000000df2')
03-09-2013 12:11:35	SELECT f_almacena_lectura(2, 0, 2, '2013-09-03 12:11:35', 2, 51, '2667000000100000000df2')
03-09-2013 12:11:37	SELECT f_almacena_lectura(0, 0, 1, '2013-09-03 12:11:37', 2, 51, '2658000000000000000be6')
03-09-2013 12:11:39	SELECT f_almacena_lectura(0, 0, 1, '2013-09-03 12:11:39', 2, 51, '2658000000000000000e0d')
03-09-2013 12:11:41	SELECT f_almacena_lectura(0, 0, 1, '2013-09-03 12:11:41', 2, 51, '2667000000100000000df2')
03-09-2013 12:13:10	SELECT f_almacena_lectura(0, 0, 0, '2013-09-03 12:13:10', 2, 51, '79000000000000000fd6')
03-09-2013 12:13:10	SELECT f_almacena_lectura(2, 0, 2, '2013-09-03 12:13:10', 2, 51, '79000000000000000fd6')
03-09-2013 12:13:12	SELECT f_almacena_lectura(0, 0, 0, '2013-09-03 12:13:12', 2, 51, '79000000000000000fca')
03-09-2013 12:13:12	SELECT f_almacena_lectura(2, 0, 2, '2013-09-03 12:13:12', 2, 51, '79000000000000000fca')
03-09-2013 12:13:14	SELECT f_almacena_lectura(0, 0, 0, '2013-09-03 12:13:14', 2, 51, '79000000000000001015')
03-09-2013 12:13:14	SELECT f_almacena_lectura(2, 0, 2, '2013-09-03 12:13:14', 2, 51, '79000000000000001015')
03-09-2013 12:13:16	SELECT f_almacena_lectura(0, 0, 1, '2013-09-03 12:13:16', 2, 51, '79000000000000000fd6')
03-09-2013 12:13:16	SELECT f_almacena_lectura(0, 0, 0, '2013-09-03 12:13:16', 2, 51, '79000000000000000fec')
03-09-2013 12:13:16	SELECT f_almacena_lectura(2, 0, 2, '2013-09-03 12:13:16', 2, 51, '79000000000000000fec')
03-09-2013 12:13:18	SELECT f_almacena_lectura(0, 0, 1, '2013-09-03 12:13:18', 2, 51, '79000000000000000fca')
03-09-2013 12:13:18	SELECT f_almacena_lectura(0, 0, 0, '2013-09-03 12:13:18', 2, 51, '79000000000000000fa8')
03-09-2013 12:13:18	SELECT f_almacena_lectura(2, 0, 2, '2013-09-03 12:13:18', 2, 51, '79000000000000000fa8')
03-09-2013 12:13:20	SELECT f_almacena_lectura(0, 0, 1, '2013-09-03 12:13:20', 2, 51, '79000000000000001015')
03-09-2013 12:13:22	SELECT f_almacena_lectura(0, 0, 1, '2013-09-03 12:13:22', 2, 51, '79000000000000000fec')
03-09-2013 12:13:24	SELECT f_almacena_lectura(0, 0, 1, '2013-09-03 12:13:24', 2, 51, '79000000000000000fa8')
03-09-2013 12:17:02	SELECT f_almacena_lectura(0, 0, 0, '2013-09-03 12:17:02', 2, 51, '445988000000000000080e')
03-09-2013 12:17:02	SELECT f_almacena_lectura(2, 0, 2, '2013-09-03 12:17:02', 2, 51, '445988000000000000080e')
03-09-2013 12:17:05	SELECT f_almacena_lectura(0, 0, 0, '2013-09-03 12:17:05', 2, 51, '44590000000000000002cc')
03-09-2013 12:17:05	SELECT f_almacena_lectura(2, 0, 2, '2013-09-03 12:17:05', 2, 51, '44590000000000000002cc')
03-09-2013 12:17:07	SELECT f_almacena_lectura(0, 0, 0, '2013-09-03 12:17:07', 2, 51, '445900000000000000023d')
03-09-2013 12:17:07	SELECT f_almacena_lectura(2, 0, 2, '2013-09-03 12:17:07', 2, 51, '445900000000000000023d')
03-09-2013 12:17:08	SELECT f_almacena_lectura(0, 0, 1, '2013-09-03 12:17:08', 2, 51, '445988000000000000080e')
03-09-2013 12:17:10	SELECT f_almacena_lectura(0, 0, 1, '2013-09-03 12:17:10', 2, 51, '44590000000000000002cc')
03-09-2013 12:17:13	SELECT f_almacena_lectura(0, 0, 1, '2013-09-03 12:17:13', 2, 51, '445900000000000000023d')
03-09-2013 12:18:17	SELECT f_almacena_lectura(0, 0, 0, '2013-09-03 12:18:17', 2, 51, '217400000000000000442c')
03-09-2013 12:18:17	SELECT f_almacena_lectura(2, 0, 2, '2013-09-03 12:18:17', 2, 51, '217400000000000000442c')
03-09-2013 12:18:22	SELECT f_almacena_lectura(0, 0, 1, '2013-09-03 12:18:22', 2, 51, '217400000000000000442c')
03-09-2013 12:19:38	SELECT f_almacena_lectura(0, 0, 0, '2013-09-03 12:19:38', 2, 51, '201212018447010001010177')
03-09-2013 12:19:38	SELECT f_almacena_lectura(2, 0, 2, '2013-09-03 12:19:38', 2, 51, '201212018447010001010177')
03-09-2013 12:19:44	SELECT f_almacena_lectura(0, 0, 1, '2013-09-03 12:19:44', 2, 51, '201212018447010001010177')
03-09-2013 12:20:29	SELECT f_almacena_lectura(0, 0, 0, '2013-09-03 12:20:29', 2, 51, '2013032085100300010400d0')
03-09-2013 12:20:29	SELECT f_almacena_lectura(2, 0, 2, '2013-09-03 12:20:29', 2, 51, '2013032085100300010400d0')
03-09-2013 12:20:36	SELECT f_almacena_lectura(0, 0, 1, '2013-09-03 12:20:36', 2, 51, '2013032085100300010400d0')
03-09-2013 12:26:36	SELECT f_almacena_lectura(0, 0, 0, '2013-09-03 12:26:36', 2, 51, 'e20020626204018622702d74')
03-09-2013 12:26:36	SELECT f_almacena_lectura(2, 0, 2, '2013-09-03 12:26:36', 2, 51, 'e20020626204018622702d74')
03-09-2013 12:26:36	SELECT f_almacena_lectura(0, 0, 0, '2013-09-03 12:26:36', 2, 51, 'e200206262040186230029bb')
03-09-2013 12:26:36	SELECT f_almacena_lectura(2, 0, 2, '2013-09-03 12:26:36', 2, 51, 'e200206262040186230029bb')
03-09-2013 12:26:37	SELECT f_almacena_lectura(0, 0, 0, '2013-09-03 12:26:37', 2, 51, 'e20020626204018623702282')
03-09-2013 12:26:37	SELECT f_almacena_lectura(2, 0, 2, '2013-09-03 12:26:37', 2, 51, 'e20020626204018623702282')
03-09-2013 12:26:37	SELECT f_almacena_lectura(0, 0, 0, '2013-09-03 12:26:37', 2, 51, 'e20020626204018623302612')
03-09-2013 12:26:37	SELECT f_almacena_lectura(2, 0, 2, '2013-09-03 12:26:37', 2, 51, 'e20020626204018623302612')
03-09-2013 12:26:39	SELECT f_almacena_lectura(0, 0, 0, '2013-09-03 12:26:39', 2, 51, 'e20020626204018624001f09')
03-09-2013 12:26:39	SELECT f_almacena_lectura(2, 0, 2, '2013-09-03 12:26:39', 2, 51, 'e20020626204018624001f09')
03-09-2013 12:26:48	SELECT f_almacena_lectura(0, 0, 1, '2013-09-03 12:26:48', 2, 51, 'e200206262040186230029bb')
03-09-2013 12:26:48	SELECT f_almacena_lectura(0, 0, 1, '2013-09-03 12:26:48', 2, 51, 'e20020626204018622702d74')
03-09-2013 12:26:48	SELECT f_almacena_lectura(0, 0, 1, '2013-09-03 12:26:48', 2, 51, 'e20020626204018623702282')
03-09-2013 12:26:49	SELECT f_almacena_lectura(0, 0, 1, '2013-09-03 12:26:49', 2, 51, 'e20020626204018623302612')
03-09-2013 12:26:49	SELECT f_almacena_lectura(0, 0, 1, '2013-09-03 12:26:49', 2, 51, 'e20020626204018624001f09')
03-09-2013 12:29:27	SELECT f_almacena_lectura(0, 0, 0, '2013-09-03 12:29:27', 2, 51, '0126000000000000001208')
03-09-2013 12:29:27	SELECT f_almacena_lectura(2, 0, 2, '2013-09-03 12:29:27', 2, 51, '0126000000000000001208')
03-09-2013 12:29:30	SELECT f_almacena_lectura(0, 0, 0, '2013-09-03 12:29:30', 2, 51, '0214000000000000000706')
03-09-2013 12:29:30	SELECT f_almacena_lectura(2, 0, 2, '2013-09-03 12:29:30', 2, 51, '0214000000000000000706')
03-09-2013 12:29:32	SELECT f_almacena_lectura(0, 0, 0, '2013-09-03 12:29:32', 2, 51, '0214000000000000000707')
03-09-2013 12:29:32	SELECT f_almacena_lectura(2, 0, 2, '2013-09-03 12:29:32', 2, 51, '0214000000000000000707')
03-09-2013 12:29:33	SELECT f_almacena_lectura(0, 0, 1, '2013-09-03 12:29:33', 2, 51, '0126000000000000001208')
03-09-2013 12:29:35	SELECT f_almacena_lectura(0, 0, 0, '2013-09-03 12:29:35', 2, 51, '01260000000000000012e0')
03-09-2013 12:29:35	SELECT f_almacena_lectura(2, 0, 2, '2013-09-03 12:29:35', 2, 51, '01260000000000000012e0')
03-09-2013 12:29:36	SELECT f_almacena_lectura(0, 0, 1, '2013-09-03 12:29:36', 2, 51, '0214000000000000000706')
03-09-2013 12:29:37	SELECT f_almacena_lectura(0, 0, 0, '2013-09-03 12:29:37', 2, 51, '01260000000000000011e0')
03-09-2013 12:29:37	SELECT f_almacena_lectura(2, 0, 2, '2013-09-03 12:29:37', 2, 51, '01260000000000000011e0')
03-09-2013 12:29:38	SELECT f_almacena_lectura(0, 0, 1, '2013-09-03 12:29:38', 2, 51, '0214000000000000000707')
03-09-2013 12:29:41	SELECT f_almacena_lectura(0, 0, 1, '2013-09-03 12:29:41', 2, 51, '01260000000000000012e0')
03-09-2013 12:29:43	SELECT f_almacena_lectura(0, 0, 1, '2013-09-03 12:29:43', 2, 51, '01260000000000000011e0')
03-09-2013 12:32:02	SELECT f_almacena_lectura(0, 0, 0, '2013-09-03 12:32:02', 2, 51, '0503191276000000000078c0')
03-09-2013 12:32:02	SELECT f_almacena_lectura(2, 0, 2, '2013-09-03 12:32:02', 2, 51, '0503191276000000000078c0')
03-09-2013 12:32:07	SELECT f_almacena_lectura(0, 0, 0, '2013-09-03 12:32:07', 2, 51, '0503191276000000000078c1')
03-09-2013 12:32:07	SELECT f_almacena_lectura(2, 0, 2, '2013-09-03 12:32:07', 2, 51, '0503191276000000000078c1')
03-09-2013 12:32:09	SELECT f_almacena_lectura(0, 0, 1, '2013-09-03 12:32:09', 2, 51, '0503191276000000000078c0')
03-09-2013 12:32:11	SELECT f_almacena_lectura(0, 0, 0, '2013-09-03 12:32:11', 2, 51, '0503191276000000000078d4')
03-09-2013 12:32:11	SELECT f_almacena_lectura(2, 0, 2, '2013-09-03 12:32:11', 2, 51, '0503191276000000000078d4')
03-09-2013 12:32:11	SELECT f_almacena_lectura(0, 0, 0, '2013-09-03 12:32:11', 2, 51, '0503191276000000000078c0')
03-09-2013 12:32:12	SELECT f_almacena_lectura(0, 0, 1, '2013-09-03 12:32:12', 2, 51, '0503191276000000000078c1')
03-09-2013 12:32:17	SELECT f_almacena_lectura(0, 0, 1, '2013-09-03 12:32:17', 2, 51, '0503191276000000000078c0')
03-09-2013 12:32:17	SELECT f_almacena_lectura(0, 0, 1, '2013-09-03 12:32:17', 2, 51, '0503191276000000000078d4')
03-09-2013 12:32:22	SELECT f_almacena_lectura(0, 0, 0, '2013-09-03 12:32:22', 2, 51, '0503191276000000000078c0')
03-09-2013 12:32:29	SELECT f_almacena_lectura(0, 0, 1, '2013-09-03 12:32:29', 2, 51, '0503191276000000000078c0')
03-09-2013 12:32:37	SELECT f_almacena_lectura(0, 0, 0, '2013-09-03 12:32:37', 2, 51, '0503191276000000000078c0')
03-09-2013 12:32:37	SELECT f_almacena_lectura(0, 0, 0, '2013-09-03 12:32:37', 2, 51, '466536000000000000000000')
03-09-2013 12:32:37	SELECT f_almacena_lectura(2, 0, 2, '2013-09-03 12:32:37', 2, 51, '466536000000000000000000')
03-09-2013 12:32:43	SELECT f_almacena_lectura(0, 0, 1, '2013-09-03 12:32:43', 2, 51, '466536000000000000000000')
03-09-2013 12:32:44	SELECT f_almacena_lectura(0, 0, 0, '2013-09-03 12:32:44', 2, 51, '0503191276000000000078c1')
03-09-2013 12:32:44	SELECT f_almacena_lectura(0, 0, 0, '2013-09-03 12:32:44', 2, 51, '0503191276000000000078d4')
03-09-2013 12:32:50	SELECT f_almacena_lectura(0, 0, 1, '2013-09-03 12:32:50', 2, 51, '0503191276000000000078d4')
03-09-2013 12:32:52	SELECT f_almacena_lectura(0, 0, 1, '2013-09-03 12:32:52', 2, 51, '0503191276000000000078c1')
03-09-2013 12:32:54	SELECT f_almacena_lectura(0, 0, 0, '2013-09-03 12:32:54', 2, 51, '0503191276000000000078c1')
03-09-2013 12:32:54	SELECT f_almacena_lectura(0, 0, 0, '2013-09-03 12:32:54', 2, 51, '0503191276000000000078d4')
03-09-2013 12:33:00	SELECT f_almacena_lectura(0, 0, 1, '2013-09-03 12:33:00', 2, 51, '0503191276000000000078d4')
03-09-2013 12:33:01	SELECT f_almacena_lectura(0, 0, 1, '2013-09-03 12:33:01', 2, 51, '0503191276000000000078c1')
03-09-2013 12:33:03	SELECT f_almacena_lectura(0, 0, 0, '2013-09-03 12:33:03', 2, 51, '0503191276000000000078c1')
03-09-2013 12:33:03	SELECT f_almacena_lectura(0, 0, 0, '2013-09-03 12:33:03', 2, 51, '0503191276000000000078d4')
03-09-2013 12:33:08	SELECT f_almacena_lectura(0, 0, 1, '2013-09-03 12:33:08', 2, 51, '0503191276000000000078d4')
03-09-2013 12:33:08	SELECT f_almacena_lectura(0, 0, 0, '2013-09-03 12:33:08', 2, 51, '0503191276000000000078d4')
03-09-2013 12:33:14	SELECT f_almacena_lectura(0, 0, 1, '2013-09-03 12:33:14', 2, 51, '0503191276000000000078c0')
03-09-2013 12:33:14	SELECT f_almacena_lectura(0, 0, 1, '2013-09-03 12:33:14', 2, 51, '0503191276000000000078d4')
03-09-2013 12:33:16	SELECT f_almacena_lectura(0, 0, 1, '2013-09-03 12:33:16', 2, 51, '0503191276000000000078c1')
03-09-2013 12:33:18	SELECT f_almacena_lectura(0, 0, 0, '2013-09-03 12:33:18', 2, 51, '0503191276000000000078c0')
03-09-2013 12:33:23	SELECT f_almacena_lectura(0, 0, 1, '2013-09-03 12:33:23', 2, 51, '0503191276000000000078c0')
03-09-2013 12:33:26	SELECT f_almacena_lectura(0, 0, 0, '2013-09-03 12:33:26', 2, 51, '0503191276000000000078c0')
03-09-2013 12:33:35	SELECT f_almacena_lectura(0, 0, 1, '2013-09-03 12:33:35', 2, 51, '0503191276000000000078c0')
03-09-2013 12:33:38	SELECT f_almacena_lectura(0, 0, 0, '2013-09-03 12:33:38', 2, 51, '0503191276000000000078d4')
03-09-2013 12:33:41	SELECT f_almacena_lectura(0, 0, 0, '2013-09-03 12:33:41', 2, 51, '0503191276000000000078c1')
03-09-2013 12:33:44	SELECT f_almacena_lectura(0, 0, 1, '2013-09-03 12:33:44', 2, 51, '0503191276000000000078d4')
03-09-2013 12:33:47	SELECT f_almacena_lectura(0, 0, 1, '2013-09-03 12:33:47', 2, 51, '0503191276000000000078c1')
03-09-2013 12:34:00	SELECT f_almacena_lectura(0, 0, 0, '2013-09-03 12:34:00', 2, 51, '0503191276000000000078c1')
03-09-2013 12:34:05	SELECT f_almacena_lectura(0, 0, 1, '2013-09-03 12:34:05', 2, 51, '0503191276000000000078c1')
03-09-2013 12:34:23	SELECT f_almacena_lectura(0, 0, 0, '2013-09-03 12:34:23', 2, 51, '0503191276000000000078d4')
03-09-2013 12:34:29	SELECT f_almacena_lectura(0, 0, 1, '2013-09-03 12:34:29', 2, 51, '0503191276000000000078d4')
03-09-2013 12:34:44	SELECT f_almacena_lectura(0, 0, 0, '2013-09-03 12:34:44', 2, 51, '0503191276000000000078c0')
03-09-2013 12:34:49	SELECT f_almacena_lectura(0, 0, 1, '2013-09-03 12:34:49', 2, 51, '0503191276000000000078c0')
03-09-2013 12:36:04	SELECT f_almacena_lectura(0, 0, 0, '2013-09-03 12:36:04', 2, 51, 'e2002062610d01730720cd15')
03-09-2013 12:36:04	SELECT f_almacena_lectura(2, 0, 2, '2013-09-03 12:36:04', 2, 51, 'e2002062610d01730720cd15')
03-09-2013 12:36:04	SELECT f_almacena_lectura(0, 0, 0, '2013-09-03 12:36:04', 2, 51, 'e2002062610d01730680d0c5')
03-09-2013 12:36:04	SELECT f_almacena_lectura(2, 0, 2, '2013-09-03 12:36:04', 2, 51, 'e2002062610d01730680d0c5')
03-09-2013 12:36:05	SELECT f_almacena_lectura(0, 0, 0, '2013-09-03 12:36:05', 2, 51, 'e2002062610d01730960b569')
03-09-2013 12:36:05	SELECT f_almacena_lectura(2, 0, 2, '2013-09-03 12:36:05', 2, 51, 'e2002062610d01730960b569')
03-09-2013 12:36:06	SELECT f_almacena_lectura(0, 0, 0, '2013-09-03 12:36:06', 2, 51, 'e2002062610d01730920b981')
03-09-2013 12:36:06	SELECT f_almacena_lectura(2, 0, 2, '2013-09-03 12:36:06', 2, 51, 'e2002062610d01730920b981')
03-09-2013 12:36:07	SELECT f_almacena_lectura(0, 0, 0, '2013-09-03 12:36:07', 2, 51, 'e2002062610d01730880bd8d')
03-09-2013 12:36:07	SELECT f_almacena_lectura(2, 0, 2, '2013-09-03 12:36:07', 2, 51, 'e2002062610d01730880bd8d')
03-09-2013 12:36:19	SELECT f_almacena_lectura(0, 0, 1, '2013-09-03 12:36:19', 2, 51, 'e2002062610d01730720cd15')
03-09-2013 12:36:19	SELECT f_almacena_lectura(0, 0, 1, '2013-09-03 12:36:19', 2, 51, 'e2002062610d01730680d0c5')
03-09-2013 12:36:19	SELECT f_almacena_lectura(0, 0, 1, '2013-09-03 12:36:19', 2, 51, 'e2002062610d01730880bd8d')
03-09-2013 12:36:20	SELECT f_almacena_lectura(0, 0, 1, '2013-09-03 12:36:20', 2, 51, 'e2002062610d01730960b569')
03-09-2013 12:36:20	SELECT f_almacena_lectura(0, 0, 1, '2013-09-03 12:36:20', 2, 51, 'e2002062610d01730920b981')
03-09-2013 12:37:42	SELECT f_almacena_lectura(0, 0, 0, '2013-09-03 12:37:42', 2, 51, '3005fb63ac1f3841ec880467')
03-09-2013 12:37:42	SELECT f_almacena_lectura(2, 0, 2, '2013-09-03 12:37:42', 2, 51, '3005fb63ac1f3841ec880467')
03-09-2013 12:37:43	SELECT f_almacena_lectura(0, 0, 0, '2013-09-03 12:37:43', 2, 51, 'a001fb63ac1f3841ec880467')
03-09-2013 12:37:43	SELECT f_almacena_lectura(2, 0, 2, '2013-09-03 12:37:43', 2, 51, 'a001fb63ac1f3841ec880467')
03-09-2013 12:38:02	SELECT f_almacena_lectura(0, 0, 1, '2013-09-03 12:38:02', 2, 51, 'a001fb63ac1f3841ec880467')
03-09-2013 12:38:02	SELECT f_almacena_lectura(0, 0, 0, '2013-09-03 12:38:02', 2, 51, 'a001fb63ac1f3841ec880467')
03-09-2013 12:38:17	SELECT f_almacena_lectura(0, 0, 1, '2013-09-03 12:38:17', 2, 51, 'a001fb63ac1f3841ec880467')
03-09-2013 12:38:28	SELECT f_almacena_lectura(0, 0, 1, '2013-09-03 12:38:28', 2, 51, '3005fb63ac1f3841ec880467')
03-09-2013 12:38:28	SELECT f_almacena_lectura(0, 0, 0, '2013-09-03 12:38:28', 2, 51, '3005fb63ac1f3841ec880467')
03-09-2013 12:38:30	SELECT f_almacena_lectura(0, 0, 0, '2013-09-03 12:38:30', 2, 51, 'a001fb63ac1f3841ec880467')
03-09-2013 12:38:53	SELECT f_almacena_lectura(0, 0, 1, '2013-09-03 12:38:53', 2, 51, 'a001fb63ac1f3841ec880467')
03-09-2013 12:38:59	SELECT f_almacena_lectura(0, 0, 1, '2013-09-03 12:38:59', 2, 51, '3005fb63ac1f3841ec880467')
04-09-2013 02:42:34	SELECT f_almacena_lectura(0, 0, 0, '2013-09-04 14:42:34', 2, 51, '79000000000000001015')
04-09-2013 02:42:40	SELECT f_almacena_lectura(0, 0, 1, '2013-09-04 14:42:40', 2, 51, '79000000000000001015')
04-09-2013 02:42:43	SELECT f_almacena_lectura(0, 0, 0, '2013-09-04 14:42:43', 2, 51, '2658000000000000000d57')
04-09-2013 02:42:43	SELECT f_almacena_lectura(0, 0, 0, '2013-09-04 14:42:43', 2, 51, '0127000000000000001b9a')
04-09-2013 02:42:44	SELECT f_almacena_lectura(0, 0, 0, '2013-09-04 14:42:44', 2, 51, '01260000000000000011e0')
04-09-2013 02:42:49	SELECT f_almacena_lectura(0, 0, 1, '2013-09-04 14:42:49', 2, 51, '2658000000000000000d57')
04-09-2013 02:42:49	SELECT f_almacena_lectura(0, 0, 1, '2013-09-04 14:42:49', 2, 51, '0127000000000000001b9a')
04-09-2013 02:42:49	SELECT f_almacena_lectura(0, 0, 1, '2013-09-04 14:42:49', 2, 51, '01260000000000000011e0')
04-09-2013 02:43:01	SELECT f_almacena_lectura(0, 0, 0, '2013-09-04 14:43:01', 2, 51, '0127000000000000001b9a')
04-09-2013 02:43:06	SELECT f_almacena_lectura(0, 0, 0, '2013-09-04 14:43:06', 2, 51, '2658000000000000000d57')
04-09-2013 02:43:07	SELECT f_almacena_lectura(0, 0, 1, '2013-09-04 14:43:07', 2, 51, '0127000000000000001b9a')
04-09-2013 02:43:19	SELECT f_almacena_lectura(0, 0, 0, '2013-09-04 14:43:19', 2, 51, '0214000000000000000706')
04-09-2013 02:43:21	SELECT f_almacena_lectura(0, 0, 1, '2013-09-04 14:43:21', 2, 51, '2658000000000000000d57')
04-09-2013 02:43:23	SELECT f_almacena_lectura(0, 0, 0, '2013-09-04 14:43:23', 2, 51, '01260000000000000012e0')
04-09-2013 02:43:25	SELECT f_almacena_lectura(0, 0, 1, '2013-09-04 14:43:25', 2, 51, '0214000000000000000706')
04-09-2013 02:43:26	SELECT f_almacena_lectura(0, 0, 0, '2013-09-04 14:43:26', 2, 51, '0126000000000000001208')
04-09-2013 02:43:29	SELECT f_almacena_lectura(0, 0, 1, '2013-09-04 14:43:29', 2, 51, '01260000000000000012e0')
04-09-2013 02:43:31	SELECT f_almacena_lectura(0, 0, 0, '2013-09-04 14:43:31', 2, 51, '2658000000000000000d57')
04-09-2013 02:43:32	SELECT f_almacena_lectura(0, 0, 1, '2013-09-04 14:43:32', 2, 51, '0126000000000000001208')
04-09-2013 02:43:34	SELECT f_almacena_lectura(0, 0, 0, '2013-09-04 14:43:34', 2, 51, '44590000000000000002cc')
04-09-2013 02:43:37	SELECT f_almacena_lectura(0, 0, 1, '2013-09-04 14:43:37', 2, 51, '2658000000000000000d57')
04-09-2013 02:43:37	SELECT f_almacena_lectura(0, 0, 0, '2013-09-04 14:43:37', 2, 51, '0214000000000000000707')
04-09-2013 02:43:40	SELECT f_almacena_lectura(0, 0, 1, '2013-09-04 14:43:40', 2, 51, '44590000000000000002cc')
04-09-2013 02:43:42	SELECT f_almacena_lectura(0, 0, 0, '2013-09-04 14:43:42', 2, 51, '445900000000000000023d')
04-09-2013 02:43:43	SELECT f_almacena_lectura(0, 0, 1, '2013-09-04 14:43:43', 2, 51, '0214000000000000000707')
04-09-2013 02:43:48	SELECT f_almacena_lectura(0, 0, 1, '2013-09-04 14:43:48', 2, 51, '445900000000000000023d')
04-09-2013 02:43:49	SELECT f_almacena_lectura(0, 0, 0, '2013-09-04 14:43:49', 2, 51, '445988000000000000080e')
04-09-2013 02:43:51	SELECT f_almacena_lectura(0, 0, 0, '2013-09-04 14:43:51', 2, 51, '01260000000000000011e0')
04-09-2013 02:43:54	SELECT f_almacena_lectura(0, 0, 1, '2013-09-04 14:43:54', 2, 51, '445988000000000000080e')
04-09-2013 02:43:54	SELECT f_almacena_lectura(0, 0, 0, '2013-09-04 14:43:54', 2, 51, '1936000000000000001ec3')
04-09-2013 02:43:57	SELECT f_almacena_lectura(0, 0, 1, '2013-09-04 14:43:57', 2, 51, '01260000000000000011e0')
04-09-2013 02:44:00	SELECT f_almacena_lectura(0, 0, 1, '2013-09-04 14:44:00', 2, 51, '1936000000000000001ec3')
04-09-2013 02:50:20	SELECT f_almacena_lectura(0, 0, 0, '2013-09-04 14:50:20', 2, 51, '79000000000000001015')
04-09-2013 02:50:20	SELECT f_almacena_lectura(0, 0, 0, '2013-09-04 14:50:20', 2, 51, '79000000000000001015') ERROR: query string argument of EXECUTE is null
  Where: PL/pgSQL function "f_almacena_lectura" line 53 at EXECUTE statement
04-09-2013 02:50:25	SELECT f_almacena_lectura(0, 0, 1, '2013-09-04 14:50:25', 2, 51, '79000000000000001015')
04-09-2013 02:50:25	SELECT f_almacena_lectura(0, 0, 1, '2013-09-04 14:50:25', 2, 51, '79000000000000001015') ERROR: query string argument of EXECUTE is null
  Where: PL/pgSQL function "f_almacena_lectura" line 53 at EXECUTE statement
04-09-2013 02:51:06	SELECT f_almacena_lectura(0, 0, 0, '2013-09-04 14:51:06', 2, 51, '0126000000000000001208')
04-09-2013 02:51:06	SELECT f_almacena_lectura(0, 0, 0, '2013-09-04 14:51:06', 2, 51, '0126000000000000001208') ERROR: query string argument of EXECUTE is null
  Where: PL/pgSQL function "f_almacena_lectura" line 53 at EXECUTE statement
04-09-2013 02:51:09	SELECT f_almacena_lectura(0, 0, 0, '2013-09-04 14:51:09', 2, 51, '0214000000000000000707')
04-09-2013 02:51:09	SELECT f_almacena_lectura(0, 0, 0, '2013-09-04 14:51:09', 2, 51, '0214000000000000000707') ERROR: query string argument of EXECUTE is null
  Where: PL/pgSQL function "f_almacena_lectura" line 53 at EXECUTE statement
04-09-2013 02:51:11	SELECT f_almacena_lectura(0, 0, 0, '2013-09-04 14:51:11', 2, 51, '01260000000000000011e0')
04-09-2013 02:51:11	SELECT f_almacena_lectura(0, 0, 0, '2013-09-04 14:51:11', 2, 51, '01260000000000000011e0') ERROR: query string argument of EXECUTE is null
  Where: PL/pgSQL function "f_almacena_lectura" line 53 at EXECUTE statement
04-09-2013 02:51:12	SELECT f_almacena_lectura(0, 0, 1, '2013-09-04 14:51:12', 2, 51, '0126000000000000001208')
04-09-2013 02:51:12	SELECT f_almacena_lectura(0, 0, 1, '2013-09-04 14:51:12', 2, 51, '0126000000000000001208') ERROR: query string argument of EXECUTE is null
  Where: PL/pgSQL function "f_almacena_lectura" line 53 at EXECUTE statement
04-09-2013 02:51:14	SELECT f_almacena_lectura(0, 0, 1, '2013-09-04 14:51:14', 2, 51, '0214000000000000000707')
04-09-2013 02:51:14	SELECT f_almacena_lectura(0, 0, 1, '2013-09-04 14:51:14', 2, 51, '0214000000000000000707') ERROR: query string argument of EXECUTE is null
  Where: PL/pgSQL function "f_almacena_lectura" line 53 at EXECUTE statement
04-09-2013 02:51:16	SELECT f_almacena_lectura(0, 0, 1, '2013-09-04 14:51:16', 2, 51, '01260000000000000011e0')
04-09-2013 02:51:16	SELECT f_almacena_lectura(0, 0, 1, '2013-09-04 14:51:16', 2, 51, '01260000000000000011e0') ERROR: query string argument of EXECUTE is null
  Where: PL/pgSQL function "f_almacena_lectura" line 53 at EXECUTE statement
05-09-2013 11:39:21	SELECT f_almacena_lectura(0, 0, 0, '2013-09-05 11:39:21', 2, 51, '3005fb63ac1f3841ec880467')
05-09-2013 11:39:26	SELECT f_almacena_lectura(0, 0, 1, '2013-09-05 11:39:26', 2, 51, '3005fb63ac1f3841ec880467')
05-09-2013 11:39:29	SELECT f_almacena_lectura(0, 0, 0, '2013-09-05 11:39:29', 2, 51, '3005fb63ac1f3841ec880467')
05-09-2013 11:39:34	SELECT f_almacena_lectura(0, 0, 1, '2013-09-05 11:39:34', 2, 51, '3005fb63ac1f3841ec880467')
05-09-2013 05:22:45	SELECT f_almacena_lectura(0, 0, 0, '2013-09-05 17:22:45', 2, 51, '372d055bfca26487b78f47011078')
05-09-2013 05:22:51	SELECT f_almacena_lectura(0, 0, 1, '2013-09-05 17:22:51', 2, 51, '372d055bfca26487b78f47011078')
05-09-2013 05:23:30	SELECT f_almacena_lectura(0, 0, 0, '2013-09-05 17:23:30', 2, 51, '372d055bfca26487b78f47011078')
05-09-2013 05:23:36	SELECT f_almacena_lectura(0, 0, 1, '2013-09-05 17:23:36', 2, 51, '372d055bfca26487b78f47011078')
05-09-2013 05:23:47	SELECT f_almacena_lectura(0, 0, 0, '2013-09-05 17:23:47', 2, 51, '372d055bfca26487b78f47011078')
05-09-2013 05:23:53	SELECT f_almacena_lectura(0, 0, 1, '2013-09-05 17:23:53', 2, 51, '372d055bfca26487b78f47011078')
05-09-2013 05:24:07	SELECT f_almacena_lectura(0, 0, 0, '2013-09-05 17:24:07', 2, 51, '372d055bfca26487b78f47011078')
05-09-2013 05:24:13	SELECT f_almacena_lectura(0, 0, 1, '2013-09-05 17:24:13', 2, 51, '372d055bfca26487b78f47011078')
06-09-2013 03:07:39	SELECT f_almacena_lectura(0, 0, '2013-09-06 15:07:39', 2, 51, '1936000000000000001ec3')
06-09-2013 03:07:42	SELECT f_almacena_lectura(0, 0, '2013-09-06 15:07:42', 2, 51, '0127000000000000001b9a')
06-09-2013 03:07:45	SELECT f_almacena_lectura(0, 1, '2013-09-06 15:07:45', 2, 51, '1936000000000000001ec3')
06-09-2013 03:07:47	SELECT f_almacena_lectura(0, 1, '2013-09-06 15:07:47', 2, 51, '0127000000000000001b9a')
06-09-2013 03:56:03	SELECT f_salvame_la_vida(79000000000000001015)
06-09-2013 03:56:03	SELECT f_salvame_la_vida(79000000000000001015) ERROR: function f_salvame_la_vida(numeric) does not exist
  Hint: No function matches the given name and argument types. You might need to add explicit type casts.
  Position: 8
06-09-2013 03:56:33	SELECT f_salvame_la_vida('79000000000000001015')
06-09-2013 03:56:34	SELECT f_salvame_la_vida('79000000000000001015') El ndice de la columna est fuera de rango: 0, nmero de columnas: 1.
06-09-2013 03:57:03	SELECT f_salvame_la_vida('79000000000000001015')
06-09-2013 03:57:03	SELECT f_salvame_la_vida('79000000000000001015')
06-09-2013 03:57:03	SELECT f_salvame_la_vida('466536000000000000000000')
06-09-2013 03:57:03	SELECT f_salvame_la_vida('466536000000000000000000')
06-09-2013 03:57:15	SELECT f_salvame_la_vida('79000000000000001015')
06-09-2013 03:57:15	SELECT f_salvame_la_vida('79000000000000001015')
06-09-2013 03:57:17	SELECT f_salvame_la_vida('466536000000000000000000')
06-09-2013 03:57:17	SELECT f_salvame_la_vida('466536000000000000000000')
06-09-2013 03:57:33	SELECT f_salvame_la_vida('79000000000000000fec')
06-09-2013 03:57:33	SELECT f_salvame_la_vida('79000000000000000fec')
06-09-2013 03:57:48	SELECT f_salvame_la_vida('79000000000000000fca')
06-09-2013 03:57:48	SELECT f_salvame_la_vida('79000000000000000fca')
06-09-2013 03:57:54	SELECT f_salvame_la_vida('79000000000000000fd6')
06-09-2013 03:57:54	SELECT f_salvame_la_vida('79000000000000000fd6')
06-09-2013 03:57:59	SELECT f_salvame_la_vida('201212018447010001010177')
06-09-2013 03:57:59	SELECT f_salvame_la_vida('201212018447010001010177')
06-09-2013 03:58:05	SELECT f_salvame_la_vida('79000000000000000fd6')
06-09-2013 03:58:05	SELECT f_salvame_la_vida('79000000000000000fd6')
06-09-2013 03:58:20	SELECT f_salvame_la_vida('201212018447010001010177')
06-09-2013 03:58:20	SELECT f_salvame_la_vida('201212018447010001010177')
06-09-2013 03:58:31	SELECT f_salvame_la_vida('79000000000000000fca')
06-09-2013 03:58:31	SELECT f_salvame_la_vida('79000000000000000fca')
06-09-2013 03:58:38	SELECT f_salvame_la_vida('201212018447010001010177')
06-09-2013 03:58:38	SELECT f_salvame_la_vida('201212018447010001010177')
06-09-2013 03:58:52	SELECT f_salvame_la_vida('2658000000000000000e0d')
06-09-2013 03:58:52	SELECT f_salvame_la_vida('2658000000000000000e0d')
06-09-2013 03:58:57	SELECT f_salvame_la_vida('466536000000000000000000')
06-09-2013 03:58:57	SELECT f_salvame_la_vida('466536000000000000000000')
06-09-2013 03:59:16	SELECT f_salvame_la_vida('44590000000000000002cc')
06-09-2013 03:59:16	SELECT f_salvame_la_vida('44590000000000000002cc')
06-09-2013 03:59:22	SELECT f_salvame_la_vida('2658000000000000000e0d')
06-09-2013 03:59:22	SELECT f_salvame_la_vida('2658000000000000000e0d')
06-09-2013 03:59:43	SELECT f_salvame_la_vida('44590000000000000002cc')
06-09-2013 03:59:43	SELECT f_salvame_la_vida('44590000000000000002cc')
06-09-2013 03:59:57	SELECT f_salvame_la_vida('44590000000000000002cc')
06-09-2013 03:59:57	SELECT f_salvame_la_vida('44590000000000000002cc')
06-09-2013 04:00:20	SELECT f_salvame_la_vida('2658000000000000000d57')
06-09-2013 04:00:20	SELECT f_salvame_la_vida('2658000000000000000d57')
06-09-2013 04:00:25	SELECT f_salvame_la_vida('79000000000000000fd6')
06-09-2013 04:00:25	SELECT f_salvame_la_vida('79000000000000000fd6')
06-09-2013 04:00:52	SELECT f_salvame_la_vida('0127000000000000001b62')
06-09-2013 04:00:52	SELECT f_salvame_la_vida('0127000000000000001b62')
06-09-2013 04:00:59	SELECT f_salvame_la_vida('1936000000000000001d83')
06-09-2013 04:00:59	SELECT f_salvame_la_vida('1936000000000000001d83')
06-09-2013 04:01:05	SELECT f_salvame_la_vida('01260000000000000011e0')
06-09-2013 04:01:05	SELECT f_salvame_la_vida('01260000000000000011e0')
06-09-2013 04:01:17	SELECT f_salvame_la_vida('01260000000000000011e0')
06-09-2013 04:01:17	SELECT f_salvame_la_vida('01260000000000000011e0')
06-09-2013 04:01:24	SELECT f_salvame_la_vida('01260000000000000011e0')
06-09-2013 04:01:24	SELECT f_salvame_la_vida('01260000000000000011e0')
06-09-2013 04:01:49	SELECT f_salvame_la_vida('01260000000000000011e0')
06-09-2013 04:01:49	SELECT f_salvame_la_vida('01260000000000000011e0')
06-09-2013 04:02:00	SELECT f_salvame_la_vida('0127000000000000001bfe')
06-09-2013 04:02:00	SELECT f_salvame_la_vida('0127000000000000001bfe')
06-09-2013 04:02:14	SELECT f_salvame_la_vida('0127000000000000001bfe')
06-09-2013 04:02:14	SELECT f_salvame_la_vida('0127000000000000001bfe')
06-09-2013 04:02:24	SELECT f_salvame_la_vida('2658000000000000000e08')
06-09-2013 04:02:45	SELECT f_salvame_la_vida('2658000000000000000e08') Conexin rechazada. Verifique que el nombre del Host y el puerto sean correctos y que postmaster este aceptando conexiones TCP/IP.
06-09-2013 04:02:45	SELECT f_salvame_la_vida('2658000000000000000e0d')
06-09-2013 04:02:45	SELECT f_salvame_la_vida('2658000000000000000e0d')
06-09-2013 04:02:45	SELECT f_salvame_la_vida('79000000000000000fca')
06-09-2013 04:02:45	SELECT f_salvame_la_vida('79000000000000000fca')
06-09-2013 04:02:45	SELECT f_salvame_la_vida('466536000000000000000000')
06-09-2013 04:02:45	SELECT f_salvame_la_vida('466536000000000000000000')
06-09-2013 04:02:45	SELECT f_salvame_la_vida('79000000000000000fd6')
06-09-2013 04:02:45	SELECT f_salvame_la_vida('79000000000000000fd6')
06-09-2013 04:02:45	SELECT f_salvame_la_vida('79000000000000000fa8')
06-09-2013 04:02:45	SELECT f_salvame_la_vida('79000000000000000fa8')
06-09-2013 04:02:58	SELECT f_salvame_la_vida('2658000000000000000e08')
06-09-2013 04:02:58	SELECT f_salvame_la_vida('2658000000000000000e08')
06-09-2013 04:03:04	SELECT f_salvame_la_vida('2658000000000000000d57')
06-09-2013 04:03:04	SELECT f_salvame_la_vida('2658000000000000000d57')
06-09-2013 04:03:29	SELECT f_salvame_la_vida('2658000000000000000e08')
06-09-2013 04:03:29	SELECT f_salvame_la_vida('2658000000000000000e08')
06-09-2013 04:03:44	SELECT f_salvame_la_vida('2658000000000000000e08')
06-09-2013 04:03:44	SELECT f_salvame_la_vida('2658000000000000000e08')
06-09-2013 04:04:00	SELECT f_salvame_la_vida('1936000000000000005f0a')
06-09-2013 04:04:21	SELECT f_salvame_la_vida('1936000000000000005f0a') Conexin rechazada. Verifique que el nombre del Host y el puerto sean correctos y que postmaster este aceptando conexiones TCP/IP.
06-09-2013 04:04:27	SELECT f_salvame_la_vida('1936000000000000005f0a')
06-09-2013 04:04:27	SELECT f_salvame_la_vida('1936000000000000005f0a')
06-09-2013 04:04:39	SELECT f_salvame_la_vida('445900000000000000023d')
06-09-2013 04:04:39	SELECT f_salvame_la_vida('445900000000000000023d')
06-09-2013 04:04:55	SELECT f_salvame_la_vida('2658000000000000000be6')
06-09-2013 04:04:55	SELECT f_salvame_la_vida('2658000000000000000be6')
06-09-2013 04:04:56	SELECT f_salvame_la_vida('1936000000000000005f0a')
06-09-2013 04:04:56	SELECT f_salvame_la_vida('1936000000000000005f0a')
06-09-2013 04:05:10	SELECT f_salvame_la_vida('2658000000000000000e08')
06-09-2013 04:05:10	SELECT f_salvame_la_vida('2658000000000000000e08')
06-09-2013 04:05:38	SELECT f_salvame_la_vida('2667000000100000000df2')
06-09-2013 04:05:38	SELECT f_salvame_la_vida('2667000000100000000df2')
06-09-2013 04:05:47	SELECT f_salvame_la_vida('79000000000000000fd6')
06-09-2013 04:05:47	SELECT f_salvame_la_vida('79000000000000000fd6')
06-09-2013 04:06:06	SELECT f_salvame_la_vida('2667000000100000000df2')
06-09-2013 04:06:06	SELECT f_salvame_la_vida('2667000000100000000df2')
06-09-2013 04:06:07	SELECT f_salvame_la_vida('79000000000000000fd6')
06-09-2013 04:06:07	SELECT f_salvame_la_vida('79000000000000000fd6')
06-09-2013 04:06:27	SELECT f_salvame_la_vida('2658000000000000000e08')
06-09-2013 04:06:27	SELECT f_salvame_la_vida('2658000000000000000e08')
06-09-2013 04:06:37	SELECT f_salvame_la_vida('2658000000000000000e08')
06-09-2013 04:06:37	SELECT f_salvame_la_vida('2658000000000000000e08')
06-09-2013 04:06:39	SELECT f_salvame_la_vida('79000000000000000fd6')
06-09-2013 04:06:39	SELECT f_salvame_la_vida('79000000000000000fd6')
06-09-2013 04:06:55	SELECT f_salvame_la_vida('2658000000000000000be6')
06-09-2013 04:06:55	SELECT f_salvame_la_vida('2658000000000000000be6')
06-09-2013 04:07:03	SELECT f_salvame_la_vida('466536000000000000000000')
06-09-2013 04:07:03	SELECT f_salvame_la_vida('466536000000000000000000')
06-09-2013 04:07:14	SELECT f_salvame_la_vida('0127000000000000001b62')
06-09-2013 04:07:14	SELECT f_salvame_la_vida('0127000000000000001b62')
06-09-2013 04:07:47	SELECT f_salvame_la_vida('1936000000000000001e75')
06-09-2013 04:07:47	SELECT f_salvame_la_vida('1936000000000000001e75')
06-09-2013 04:08:08	SELECT f_salvame_la_vida('0214000000000000000706')
06-09-2013 04:08:08	SELECT f_salvame_la_vida('0214000000000000000706')
06-09-2013 04:08:10	SELECT f_salvame_la_vida('466536000000000000000000')
06-09-2013 04:08:10	SELECT f_salvame_la_vida('466536000000000000000000')
06-09-2013 04:08:10	SELECT f_salvame_la_vida('1936000000000000005f0a')
06-09-2013 04:08:10	SELECT f_salvame_la_vida('1936000000000000005f0a')
06-09-2013 04:08:11	SELECT f_salvame_la_vida('1936000000000000001d83')
06-09-2013 04:08:11	SELECT f_salvame_la_vida('1936000000000000001d83')
06-09-2013 04:08:24	SELECT f_salvame_la_vida('0214000000000000000706')
06-09-2013 04:08:24	SELECT f_salvame_la_vida('0214000000000000000706')
06-09-2013 04:08:28	SELECT f_salvame_la_vida('1936000000000000005f0a')
06-09-2013 04:08:28	SELECT f_salvame_la_vida('1936000000000000005f0a')
06-09-2013 04:08:28	SELECT f_salvame_la_vida('466536000000000000000000')
06-09-2013 04:08:28	SELECT f_salvame_la_vida('466536000000000000000000')
06-09-2013 04:09:07	SELECT f_salvame_la_vida('0127000000000000001b5e')
06-09-2013 04:09:07	SELECT f_salvame_la_vida('0127000000000000001b5e')
06-09-2013 04:09:26	SELECT f_salvame_la_vida('2013032085100300010400d0')
06-09-2013 04:09:26	SELECT f_salvame_la_vida('2013032085100300010400d0')
06-09-2013 04:09:40	SELECT f_salvame_la_vida('2013032085100300010400d0')
06-09-2013 04:09:40	SELECT f_salvame_la_vida('2013032085100300010400d0')
06-09-2013 04:09:50	SELECT f_salvame_la_vida('2013032085100300010400d0')
06-09-2013 04:09:50	SELECT f_salvame_la_vida('2013032085100300010400d0')
06-09-2013 04:10:01	SELECT f_salvame_la_vida('2013032085100300010400d0')
06-09-2013 04:10:01	SELECT f_salvame_la_vida('2013032085100300010400d0')
06-09-2013 04:10:07	SELECT f_salvame_la_vida('2013032085100300010400d0')
06-09-2013 04:10:07	SELECT f_salvame_la_vida('2013032085100300010400d0')
06-09-2013 04:10:25	SELECT f_salvame_la_vida('217400000000000000442c')
06-09-2013 04:10:25	SELECT f_salvame_la_vida('217400000000000000442c')
06-09-2013 04:10:35	SELECT f_salvame_la_vida('217400000000000000442c')
06-09-2013 04:10:35	SELECT f_salvame_la_vida('217400000000000000442c')
06-09-2013 04:10:37	SELECT f_salvame_la_vida('1936000000000000005f0a')
06-09-2013 04:10:37	SELECT f_salvame_la_vida('1936000000000000005f0a')
06-09-2013 04:10:53	SELECT f_salvame_la_vida('217400000000000000442c')
06-09-2013 04:10:53	SELECT f_salvame_la_vida('217400000000000000442c')
06-09-2013 04:11:09	SELECT f_salvame_la_vida('217400000000000000442c')
06-09-2013 04:11:09	SELECT f_salvame_la_vida('217400000000000000442c')
06-09-2013 04:11:31	SELECT f_salvame_la_vida('445988000000000000080e')
06-09-2013 04:11:31	SELECT f_salvame_la_vida('445988000000000000080e')
06-09-2013 04:11:44	SELECT f_salvame_la_vida('445988000000000000080e')
06-09-2013 04:11:44	SELECT f_salvame_la_vida('445988000000000000080e')
06-09-2013 04:11:52	SELECT f_salvame_la_vida('445988000000000000080e')
06-09-2013 04:11:52	SELECT f_salvame_la_vida('445988000000000000080e')
06-09-2013 04:12:06	SELECT f_salvame_la_vida('1936000000000000001e47')
06-09-2013 04:12:06	SELECT f_salvame_la_vida('1936000000000000001e47')
06-09-2013 04:12:09	SELECT f_salvame_la_vida('1936000000000000005f0a')
06-09-2013 04:12:09	SELECT f_salvame_la_vida('1936000000000000005f0a')
06-09-2013 04:12:11	SELECT f_salvame_la_vida('1936000000000000001e47')
06-09-2013 04:12:11	SELECT f_salvame_la_vida('1936000000000000001e47')
06-09-2013 04:12:27	SELECT f_salvame_la_vida('1936000000000000001e47')
06-09-2013 04:12:27	SELECT f_salvame_la_vida('1936000000000000001e47')
06-09-2013 04:12:28	SELECT f_salvame_la_vida('1936000000000000005f0a')
06-09-2013 04:12:28	SELECT f_salvame_la_vida('1936000000000000005f0a')
06-09-2013 04:12:52	SELECT f_salvame_la_vida('0127000000000000001c00')
06-09-2013 04:12:52	SELECT f_salvame_la_vida('0127000000000000001c00')
06-09-2013 04:13:05	SELECT f_salvame_la_vida('0127000000000000001c00')
06-09-2013 04:13:05	SELECT f_salvame_la_vida('0127000000000000001c00')
06-09-2013 04:13:21	SELECT f_salvame_la_vida('0127000000000000001c00')
06-09-2013 04:13:21	SELECT f_salvame_la_vida('0127000000000000001c00')
06-09-2013 04:13:27	SELECT f_salvame_la_vida('0127000000000000001c00')
06-09-2013 04:13:27	SELECT f_salvame_la_vida('0127000000000000001c00')
06-09-2013 04:13:45	SELECT f_salvame_la_vida('0127000000000000001c00')
06-09-2013 04:13:45	SELECT f_salvame_la_vida('0127000000000000001c00')
06-09-2013 04:13:59	SELECT f_salvame_la_vida('0127000000000000001b5e')
06-09-2013 04:13:59	SELECT f_salvame_la_vida('0127000000000000001b5e')
06-09-2013 04:14:16	SELECT f_salvame_la_vida('0127000000000000001b62')
06-09-2013 04:14:16	SELECT f_salvame_la_vida('0127000000000000001b62')
06-09-2013 04:14:31	SELECT f_salvame_la_vida('0127000000000000001bfe')
06-09-2013 04:14:31	SELECT f_salvame_la_vida('0127000000000000001bfe')
06-09-2013 04:14:50	SELECT f_salvame_la_vida('0127000000000000001bfe')
06-09-2013 04:14:50	SELECT f_salvame_la_vida('0127000000000000001bfe')
06-09-2013 04:14:59	SELECT f_salvame_la_vida('0127000000000000001bfe')
06-09-2013 04:14:59	SELECT f_salvame_la_vida('0127000000000000001bfe')
06-09-2013 04:15:37	SELECT f_salvame_la_vida('79000000000000000fd6')
06-09-2013 04:15:37	SELECT f_salvame_la_vida('79000000000000000fd6')
06-09-2013 04:15:56	SELECT f_salvame_la_vida('79000000000000000fd6')
06-09-2013 04:15:56	SELECT f_salvame_la_vida('79000000000000000fd6')
06-09-2013 04:16:03	SELECT f_salvame_la_vida('79000000000000000fd6')
06-09-2013 04:16:03	SELECT f_salvame_la_vida('79000000000000000fd6')
06-09-2013 04:16:10	SELECT f_salvame_la_vida('79000000000000000fd6')
06-09-2013 04:16:10	SELECT f_salvame_la_vida('79000000000000000fd6')
06-09-2013 04:16:31	SELECT f_salvame_la_vida('79000000000000000fec')
06-09-2013 04:16:31	SELECT f_salvame_la_vida('79000000000000000fec')
06-09-2013 04:16:42	SELECT f_salvame_la_vida('79000000000000000fec')
06-09-2013 04:16:42	SELECT f_salvame_la_vida('79000000000000000fec')
06-09-2013 04:16:54	SELECT f_salvame_la_vida('79000000000000000fec')
06-09-2013 04:16:54	SELECT f_salvame_la_vida('79000000000000000fec')
06-09-2013 04:17:03	SELECT f_salvame_la_vida('79000000000000000fec')
06-09-2013 04:17:03	SELECT f_salvame_la_vida('79000000000000000fec')
06-09-2013 04:17:21	SELECT f_salvame_la_vida('79000000000000000fec')
06-09-2013 04:17:21	SELECT f_salvame_la_vida('79000000000000000fec')
06-09-2013 04:17:39	SELECT f_salvame_la_vida('79000000000000000fca')
06-09-2013 04:17:39	SELECT f_salvame_la_vida('79000000000000000fca')
06-09-2013 04:17:48	SELECT f_salvame_la_vida('79000000000000000fca')
06-09-2013 04:17:48	SELECT f_salvame_la_vida('79000000000000000fca')
06-09-2013 04:18:16	SELECT f_salvame_la_vida('79000000000000001015')
06-09-2013 04:18:16	SELECT f_salvame_la_vida('79000000000000001015')
06-09-2013 04:18:34	SELECT f_salvame_la_vida('79000000000000001015')
06-09-2013 04:18:34	SELECT f_salvame_la_vida('79000000000000001015')
06-09-2013 04:18:58	SELECT f_salvame_la_vida('79000000000000000fa8')
06-09-2013 04:18:58	SELECT f_salvame_la_vida('79000000000000000fa8')
06-09-2013 04:19:11	SELECT f_salvame_la_vida('79000000000000000fa8')
06-09-2013 04:19:11	SELECT f_salvame_la_vida('79000000000000000fa8')
06-09-2013 04:19:19	SELECT f_salvame_la_vida('79000000000000000fa8')
06-09-2013 04:19:19	SELECT f_salvame_la_vida('79000000000000000fa8')
06-09-2013 04:19:25	SELECT f_salvame_la_vida('79000000000000000fa8')
06-09-2013 04:19:25	SELECT f_salvame_la_vida('79000000000000000fa8')
06-09-2013 04:19:34	SELECT f_salvame_la_vida('1936000000000000005f0a')
06-09-2013 04:19:55	SELECT f_salvame_la_vida('1936000000000000005f0a') Conexin rechazada. Verifique que el nombre del Host y el puerto sean correctos y que postmaster este aceptando conexiones TCP/IP.
06-09-2013 04:20:01	SELECT f_salvame_la_vida('79000000000000000fa8')
06-09-2013 04:20:01	SELECT f_salvame_la_vida('79000000000000000fa8')
06-09-2013 04:20:22	SELECT f_salvame_la_vida('79000000000000000fa8')
06-09-2013 04:20:22	SELECT f_salvame_la_vida('79000000000000000fa8')
06-09-2013 04:20:25	SELECT f_salvame_la_vida('201212018447010001010177')
06-09-2013 04:20:25	SELECT f_salvame_la_vida('201212018447010001010177')
06-09-2013 04:20:30	SELECT f_salvame_la_vida('79000000000000000fa8')
06-09-2013 04:20:30	SELECT f_salvame_la_vida('79000000000000000fa8')
06-09-2013 04:20:38	SELECT f_salvame_la_vida('201212018447010001010177')
06-09-2013 04:20:38	SELECT f_salvame_la_vida('201212018447010001010177')
06-09-2013 04:20:44	SELECT f_salvame_la_vida('79000000000000000fa8')
06-09-2013 04:20:44	SELECT f_salvame_la_vida('79000000000000000fa8')
06-09-2013 04:20:52	SELECT f_salvame_la_vida('466536000000000000000000')
06-09-2013 04:20:52	SELECT f_salvame_la_vida('466536000000000000000000')
06-09-2013 04:21:19	SELECT f_salvame_la_vida('79000000000000000fec')
06-09-2013 04:21:19	SELECT f_salvame_la_vida('79000000000000000fec')
06-09-2013 04:21:21	SELECT f_salvame_la_vida('466536000000000000000000')
06-09-2013 04:21:21	SELECT f_salvame_la_vida('466536000000000000000000')
06-09-2013 04:21:23	SELECT f_salvame_la_vida('79000000000000000fa8')
06-09-2013 04:21:23	SELECT f_salvame_la_vida('79000000000000000fa8')
06-09-2013 04:21:23	SELECT f_salvame_la_vida('201212018447010001010177')
06-09-2013 04:21:23	SELECT f_salvame_la_vida('201212018447010001010177')
06-09-2013 04:21:30	SELECT f_salvame_la_vida('201212018447010001010177')
06-09-2013 04:21:30	SELECT f_salvame_la_vida('201212018447010001010177')
06-09-2013 04:21:40	SELECT f_salvame_la_vida('466536000000000000000000')
06-09-2013 04:21:40	SELECT f_salvame_la_vida('466536000000000000000000')
06-09-2013 04:21:54	SELECT f_salvame_la_vida('79000000000000000fa8')
06-09-2013 04:21:54	SELECT f_salvame_la_vida('79000000000000000fa8')
06-09-2013 04:21:56	SELECT f_salvame_la_vida('466536000000000000000000')
06-09-2013 04:22:17	SELECT f_salvame_la_vida('466536000000000000000000') Conexin rechazada. Verifique que el nombre del Host y el puerto sean correctos y que postmaster este aceptando conexiones TCP/IP.
06-09-2013 04:22:22	SELECT f_salvame_la_vida('79000000000000000fa8')
06-09-2013 04:22:22	SELECT f_salvame_la_vida('79000000000000000fa8')
06-09-2013 04:22:26	SELECT f_salvame_la_vida('0127000000000000001b9a')
06-09-2013 04:22:26	SELECT f_salvame_la_vida('0127000000000000001b9a')
06-09-2013 04:22:26	SELECT f_salvame_la_vida('1936000000000000001d83')
06-09-2013 04:22:26	SELECT f_salvame_la_vida('1936000000000000001d83')
06-09-2013 04:22:26	SELECT f_salvame_la_vida('217400000000000000442c')
06-09-2013 04:22:26	SELECT f_salvame_la_vida('217400000000000000442c')
06-09-2013 04:22:33	SELECT f_salvame_la_vida('201212018447010001010177')
06-09-2013 04:22:33	SELECT f_salvame_la_vida('201212018447010001010177')
06-09-2013 04:22:42	SELECT f_salvame_la_vida('201212018447010001010177')
06-09-2013 04:22:42	SELECT f_salvame_la_vida('201212018447010001010177')
06-09-2013 04:22:42	SELECT f_salvame_la_vida('1936000000000000001d83')
06-09-2013 04:22:42	SELECT f_salvame_la_vida('1936000000000000001d83')
06-09-2013 04:22:54	SELECT f_salvame_la_vida('79000000000000000fa8')
06-09-2013 04:22:54	SELECT f_salvame_la_vida('79000000000000000fa8')
06-09-2013 04:23:01	SELECT f_salvame_la_vida('79000000000000000fa8')
06-09-2013 04:23:01	SELECT f_salvame_la_vida('79000000000000000fa8')
06-09-2013 04:23:20	SELECT f_salvame_la_vida('79000000000000000fa8')
06-09-2013 04:23:20	SELECT f_salvame_la_vida('79000000000000000fa8')
06-09-2013 04:23:23	SELECT f_salvame_la_vida('201212018447010001010177')
06-09-2013 04:23:23	SELECT f_salvame_la_vida('201212018447010001010177')
06-09-2013 04:24:12	SELECT f_salvame_la_vida('79000000000000000fca')
06-09-2013 04:24:12	SELECT f_salvame_la_vida('79000000000000000fca')
06-09-2013 04:24:33	SELECT f_salvame_la_vida('79000000000000000fca')
06-09-2013 04:24:33	SELECT f_salvame_la_vida('79000000000000000fca')
06-09-2013 04:24:37	SELECT f_salvame_la_vida('466536000000000000000000')
06-09-2013 04:24:37	SELECT f_salvame_la_vida('466536000000000000000000')
06-09-2013 04:24:44	SELECT f_salvame_la_vida('201212018447010001010177')
06-09-2013 04:24:44	SELECT f_salvame_la_vida('201212018447010001010177')
06-09-2013 04:24:49	SELECT f_salvame_la_vida('466536000000000000000000')
06-09-2013 04:24:49	SELECT f_salvame_la_vida('466536000000000000000000')
06-09-2013 04:24:51	SELECT f_salvame_la_vida('201212018447010001010177')
06-09-2013 04:24:51	SELECT f_salvame_la_vida('201212018447010001010177')
06-09-2013 04:25:01	SELECT f_salvame_la_vida('79000000000000001015')
06-09-2013 04:25:01	SELECT f_salvame_la_vida('79000000000000001015')
06-09-2013 04:25:02	SELECT f_salvame_la_vida('79000000000000000fca')
06-09-2013 04:25:02	SELECT f_salvame_la_vida('79000000000000000fca')
06-09-2013 04:25:02	SELECT f_salvame_la_vida('466536000000000000000000')
06-09-2013 04:25:02	SELECT f_salvame_la_vida('466536000000000000000000')
06-09-2013 04:25:04	SELECT f_salvame_la_vida('201212018447010001010177')
06-09-2013 04:25:04	SELECT f_salvame_la_vida('201212018447010001010177')
06-09-2013 04:25:10	SELECT f_salvame_la_vida('79000000000000000fca')
06-09-2013 04:25:10	SELECT f_salvame_la_vida('79000000000000000fca')
06-09-2013 04:26:00	SELECT f_salvame_la_vida('0127000000000000001bfe')
06-09-2013 04:26:00	SELECT f_salvame_la_vida('0127000000000000001bfe')
06-09-2013 04:26:17	SELECT f_salvame_la_vida('2658000000000000000d57')
06-09-2013 04:26:17	SELECT f_salvame_la_vida('2658000000000000000d57')
06-09-2013 04:26:19	SELECT f_salvame_la_vida('2658000000000000000d57')
06-09-2013 04:26:19	SELECT f_salvame_la_vida('2658000000000000000d57')
06-09-2013 04:26:53	SELECT f_salvame_la_vida('201212018447010001010177')
06-09-2013 04:26:53	SELECT f_salvame_la_vida('201212018447010001010177')
06-09-2013 04:29:40	SELECT f_almacena_lectura(0, 0, '2013-09-06 16:29:40', 2, 47, '201212018447010001010177')
06-09-2013 04:29:40	SELECT f_almacena_lectura(0, 0, '2013-09-06 16:29:40', 2, 47, '201212018447010001010177')
06-09-2013 04:29:56	SELECT f_almacena_lectura(0, 1, '2013-09-06 16:29:56', 2, 47, '201212018447010001010177')
06-09-2013 04:29:56	SELECT f_almacena_lectura(0, 1, '2013-09-06 16:29:56', 2, 47, '201212018447010001010177')
06-09-2013 04:30:16	SELECT f_almacena_lectura(0, 0, '2013-09-06 16:30:16', 2, 47, '201212018447010001010177')
06-09-2013 04:30:16	SELECT f_almacena_lectura(0, 0, '2013-09-06 16:30:16', 2, 47, '201212018447010001010177')
06-09-2013 04:30:21	SELECT f_almacena_lectura(0, 1, '2013-09-06 16:30:21', 2, 47, '201212018447010001010177')
06-09-2013 04:30:21	SELECT f_almacena_lectura(0, 1, '2013-09-06 16:30:21', 2, 47, '201212018447010001010177')
06-09-2013 04:30:24	SELECT f_almacena_lectura(0, 0, '2013-09-06 16:30:24', 2, 47, '201212018447010001010177')
06-09-2013 04:30:24	SELECT f_almacena_lectura(0, 0, '2013-09-06 16:30:24', 2, 47, '201212018447010001010177')
06-09-2013 04:30:30	SELECT f_almacena_lectura(0, 1, '2013-09-06 16:30:30', 2, 47, '201212018447010001010177')
06-09-2013 04:30:30	SELECT f_almacena_lectura(0, 1, '2013-09-06 16:30:30', 2, 47, '201212018447010001010177')
06-09-2013 04:30:32	SELECT f_almacena_lectura(0, 0, '2013-09-06 16:30:32', 2, 47, '201212018447010001010177')
06-09-2013 04:30:32	SELECT f_almacena_lectura(0, 0, '2013-09-06 16:30:32', 2, 47, '201212018447010001010177')
06-09-2013 04:30:38	SELECT f_almacena_lectura(0, 1, '2013-09-06 16:30:38', 2, 47, '201212018447010001010177')
06-09-2013 04:30:38	SELECT f_almacena_lectura(0, 1, '2013-09-06 16:30:38', 2, 47, '201212018447010001010177')
06-09-2013 04:58:10	SELECT f_almacena_lectura(0, 0, '2013-09-06 16:58:10', 1, 47, '445900000000000000025b')
06-09-2013 04:58:12	SELECT f_almacena_lectura(0, 0, '2013-09-06 16:58:12', 1, 47, '3005fb63ac1f3841ec880467')
06-09-2013 04:58:16	SELECT f_almacena_lectura(0, 0, '2013-09-06 16:58:16', 1, 47, 'a001fb63ac1f3841ec880467')
06-09-2013 04:58:16	SELECT f_almacena_lectura(0, 1, '2013-09-06 16:58:16', 1, 47, '445900000000000000025b')
06-09-2013 04:58:21	SELECT f_almacena_lectura(0, 0, '2013-09-06 16:58:21', 1, 47, '372d055bfca26487b78f47011078')
06-09-2013 04:58:21	SELECT f_almacena_lectura(0, 1, '2013-09-06 16:58:21', 1, 47, 'a001fb63ac1f3841ec880467')
06-09-2013 04:58:22	SELECT f_almacena_lectura(0, 1, '2013-09-06 16:58:22', 1, 47, '3005fb63ac1f3841ec880467')
06-09-2013 04:58:26	SELECT f_almacena_lectura(0, 1, '2013-09-06 16:58:26', 1, 47, '372d055bfca26487b78f47011078')
06-09-2013 04:58:36	SELECT f_almacena_lectura(0, 0, '2013-09-06 16:58:36', 1, 47, '372d055bfca26487b78f47011078')
06-09-2013 04:58:41	SELECT f_almacena_lectura(0, 0, '2013-09-06 16:58:41', 1, 47, '445900000000000000025b')
06-09-2013 04:58:42	SELECT f_almacena_lectura(0, 1, '2013-09-06 16:58:42', 1, 47, '372d055bfca26487b78f47011078')
06-09-2013 04:58:46	SELECT f_almacena_lectura(0, 1, '2013-09-06 16:58:46', 1, 47, '445900000000000000025b')
06-09-2013 05:03:52	SELECT f_almacena_lectura(0, 0, '2013-09-06 17:03:52', 1, 47, '445900000000000000025b')
06-09-2013 05:03:55	SELECT f_almacena_lectura(0, 0, '2013-09-06 17:03:55', 1, 47, '372d055bfca26487b78f47011078')
06-09-2013 05:03:57	SELECT f_almacena_lectura(0, 0, '2013-09-06 17:03:57', 1, 47, '3005fb63ac1f3841ec880467')
06-09-2013 05:03:57	SELECT f_almacena_lectura(0, 0, '2013-09-06 17:03:57', 1, 47, 'a001fb63ac1f3841ec880467')
06-09-2013 05:03:58	SELECT f_almacena_lectura(0, 1, '2013-09-06 17:03:58', 1, 47, '445900000000000000025b')
06-09-2013 05:04:01	SELECT f_almacena_lectura(0, 1, '2013-09-06 17:04:01', 1, 47, '372d055bfca26487b78f47011078')
06-09-2013 05:04:09	SELECT f_almacena_lectura(0, 0, '2013-09-06 17:04:09', 1, 47, '372d055bfca26487b78f47011078')
06-09-2013 05:04:11	SELECT f_almacena_lectura(0, 1, '2013-09-06 17:04:11', 1, 47, '3005fb63ac1f3841ec880467')
06-09-2013 05:04:11	SELECT f_almacena_lectura(0, 1, '2013-09-06 17:04:11', 1, 47, 'a001fb63ac1f3841ec880467')
06-09-2013 05:04:11	SELECT f_almacena_lectura(0, 0, '2013-09-06 17:04:11', 1, 47, '445900000000000000025b')
06-09-2013 05:04:15	SELECT f_almacena_lectura(0, 1, '2013-09-06 17:04:15', 1, 47, '372d055bfca26487b78f47011078')
06-09-2013 05:04:17	SELECT f_almacena_lectura(0, 1, '2013-09-06 17:04:17', 1, 47, '445900000000000000025b')
09-09-2013 10:57:34	SELECT f_almacena_lectura(0, 0, '2013-09-09 10:57:34', 1, 47, '466536000000000000000000')
09-09-2013 11:01:33	SELECT f_almacena_lectura(0, 1, '2013-09-09 11:01:33', 1, 47, '466536000000000000000000')
10-09-2013 09:49:41	SELECT f_almacena_lectura(0, 0, '2013-09-10 09:49:41', 1, 47, '445900000000000000025b')
10-09-2013 09:49:47	SELECT f_almacena_lectura(0, 1, '2013-09-10 09:49:47', 1, 47, '445900000000000000025b')
10-09-2013 10:10:31	SELECT f_almacena_lectura(0, 0, '2013-09-10 10:10:31', 1, 47, '2667000000100000000df2')
10-09-2013 10:10:36	SELECT f_almacena_lectura(0, 1, '2013-09-10 10:10:36', 1, 47, '2667000000100000000df2')
10-09-2013 10:10:38	SELECT f_almacena_lectura(0, 0, '2013-09-10 10:10:38', 1, 47, '2667000000100000000df2')
10-09-2013 10:10:40	SELECT f_almacena_lectura(0, 0, '2013-09-10 10:10:40', 1, 47, '466536000000000000000000')
10-09-2013 10:10:45	SELECT f_almacena_lectura(0, 1, '2013-09-10 10:10:45', 1, 47, '466536000000000000000000')
10-09-2013 10:10:46	SELECT f_almacena_lectura(0, 1, '2013-09-10 10:10:46', 1, 47, '2667000000100000000df2')
10-09-2013 10:17:48	SELECT f_almacena_lectura(0, 0, '2013-09-10 10:17:48', 1, 47, '2667000000100000000df2')
10-09-2013 10:31:29	SELECT f_almacena_lectura(0, 0, '2013-09-10 10:31:29', 1, 47, '2667000000100000000df2')
10-09-2013 10:31:30	SELECT f_almacena_lectura(0, 0, '2013-09-10 10:31:30', 1, 47, '466536000000000000000000')
10-09-2013 10:31:35	SELECT f_almacena_lectura(0, 1, '2013-09-10 10:31:35', 1, 47, '2667000000100000000df2')
10-09-2013 10:31:35	SELECT f_almacena_lectura(0, 1, '2013-09-10 10:31:35', 1, 47, '466536000000000000000000')
10-09-2013 10:46:05	SELECT f_almacena_lectura(0, 0, '2013-09-10 10:46:05', 2, 47, '2667000000100000000df2')
10-09-2013 10:55:43	SELECT f_almacena_lectura(0, 0, '2013-09-10 10:55:43', 2, 47, '2667000000100000000df2')
10-09-2013 10:55:49	SELECT f_almacena_lectura(0, 1, '2013-09-10 10:55:49', 2, 47, '2667000000100000000df2')
10-09-2013 10:55:49	SELECT f_almacena_lectura(0, 0, '2013-09-10 10:55:49', 1, 47, '2667000000100000000df2')
10-09-2013 10:55:49	SELECT f_almacena_lectura(100,2, '2013-09-10 10:55:49', 1, 47, '2667000000100000000df2')
10-09-2013 10:55:55	SELECT f_almacena_lectura(0, 1, '2013-09-10 10:55:55', 1, 47, '2667000000100000000df2')
10-09-2013 10:56:20	SELECT f_finaliza_inventario(100)
10-09-2013 10:57:35	SELECT f_almacena_lectura(0, 0, '2013-09-10 10:57:35', 2, 47, '2667000000100000000df2')
10-09-2013 10:57:37	SELECT f_almacena_lectura(100,2, '2013-09-10 10:57:37', 1, 47, '2667000000100000000df2')
10-09-2013 10:57:53	SELECT f_almacena_lectura(0, 1, '2013-09-10 10:57:53', 2, 47, '2667000000100000000df2')
10-09-2013 10:57:55	SELECT f_almacena_lectura(0, 0, '2013-09-10 10:57:55', 1, 47, '2667000000100000000df2')
10-09-2013 10:58:01	SELECT f_almacena_lectura(0, 1, '2013-09-10 10:58:01', 1, 47, '2667000000100000000df2')
10-09-2013 10:58:04	SELECT f_almacena_lectura(0, 0, '2013-09-10 10:58:04', 2, 47, '2667000000100000000df2')
10-09-2013 10:58:09	SELECT f_almacena_lectura(0, 1, '2013-09-10 10:58:09', 2, 47, '2667000000100000000df2')
10-09-2013 10:58:24	SELECT f_almacena_lectura(0, 0, '2013-09-10 10:58:24', 2, 47, '2667000000100000000df2')
10-09-2013 10:58:29	SELECT f_almacena_lectura(0, 1, '2013-09-10 10:58:29', 2, 47, '2667000000100000000df2')
10-09-2013 10:58:48	SELECT f_almacena_lectura(0, 0, '2013-09-10 10:58:48', 2, 47, '2667000000100000000df2')
10-09-2013 10:58:53	SELECT f_almacena_lectura(0, 1, '2013-09-10 10:58:53', 2, 47, '2667000000100000000df2')
10-09-2013 10:59:00	SELECT f_finaliza_inventario(100)
10-09-2013 11:00:07	SELECT f_almacena_lectura(0, 0, '2013-09-10 11:00:07', 2, 47, '2667000000100000000df2')
10-09-2013 11:00:17	SELECT f_almacena_lectura(100,2, '2013-09-10 11:00:17', 1, 47, '2667000000100000000df2')
10-09-2013 11:00:20	SELECT f_finaliza_inventario(100)
10-09-2013 11:00:22	SELECT f_almacena_lectura(0, 1, '2013-09-10 11:00:22', 2, 47, '2667000000100000000df2')
10-09-2013 02:32:59	SELECT f_almacena_lectura(0, 0, '2013-09-10 14:32:59', 1, 47, '466536000000000000000000')
10-09-2013 02:33:05	SELECT f_almacena_lectura(0, 1, '2013-09-10 14:33:05', 1, 47, '466536000000000000000000')
10-09-2013 02:33:09	SELECT f_almacena_lectura(0, 0, '2013-09-10 14:33:09', 1, 47, '466536000000000000000000')
10-09-2013 02:33:15	SELECT f_almacena_lectura(0, 1, '2013-09-10 14:33:15', 1, 47, '466536000000000000000000')
10-09-2013 03:45:34	SELECT f_finaliza_inventario(2)
10-09-2013 03:55:33	SELECT f_almacena_lectura(0, 0, '2013-09-10 15:55:33', 1, 47, '2667000000100000000df2')
10-09-2013 03:55:33	SELECT f_almacena_lectura(0, 0, '2013-09-10 15:55:33', 1, 47, '2667000000100000000df2')
10-09-2013 03:55:38	SELECT f_almacena_lectura(0, 1, '2013-09-10 15:55:38', 1, 47, '2667000000100000000df2')
10-09-2013 03:55:38	SELECT f_almacena_lectura(0, 1, '2013-09-10 15:55:38', 1, 47, '2667000000100000000df2')
10-09-2013 03:55:40	SELECT f_almacena_lectura(0, 0, '2013-09-10 15:55:40', 1, 47, '2667000000100000000df2')
10-09-2013 03:55:40	SELECT f_almacena_lectura(0, 0, '2013-09-10 15:55:40', 1, 47, '2667000000100000000df2')
10-09-2013 03:55:47	SELECT f_almacena_lectura(0, 1, '2013-09-10 15:55:47', 1, 47, '2667000000100000000df2')
10-09-2013 03:55:47	SELECT f_almacena_lectura(0, 1, '2013-09-10 15:55:47', 1, 47, '2667000000100000000df2')
10-09-2013 03:55:47	SELECT f_almacena_lectura(0, 0, '2013-09-10 15:55:47', 2, 47, '2667000000100000000df2')
10-09-2013 03:55:47	SELECT f_almacena_lectura(0, 0, '2013-09-10 15:55:47', 2, 47, '2667000000100000000df2')
10-09-2013 03:55:54	SELECT f_almacena_lectura(0, 1, '2013-09-10 15:55:54', 2, 47, '2667000000100000000df2')
10-09-2013 03:55:54	SELECT f_almacena_lectura(0, 1, '2013-09-10 15:55:54', 2, 47, '2667000000100000000df2')
10-09-2013 04:32:03	SELECT f_almacena_lectura(0, 0, '2013-09-10 16:32:03', 1, 47, '2658000000000000000be6')
10-09-2013 04:32:03	SELECT f_almacena_lectura(0, 0, '2013-09-10 16:32:03', 1, 47, '2658000000000000000be6')
10-09-2013 04:32:08	SELECT f_almacena_lectura(0, 1, '2013-09-10 16:32:08', 1, 47, '2658000000000000000be6')
10-09-2013 04:32:08	SELECT f_almacena_lectura(0, 1, '2013-09-10 16:32:08', 1, 47, '2658000000000000000be6')
10-09-2013 04:32:14	SELECT f_almacena_lectura(0, 0, '2013-09-10 16:32:14', 1, 47, '2658000000000000000be6')
10-09-2013 04:32:14	SELECT f_almacena_lectura(0, 0, '2013-09-10 16:32:14', 1, 47, '2658000000000000000be6')
10-09-2013 04:32:19	SELECT f_almacena_lectura(0, 1, '2013-09-10 16:32:19', 1, 47, '2658000000000000000be6')
10-09-2013 04:32:19	SELECT f_almacena_lectura(0, 1, '2013-09-10 16:32:19', 1, 47, '2658000000000000000be6')
11-09-2013 09:59:47	SELECT f_almacena_lectura(0, 0, '2013-09-11 09:59:47', 1, 47, '466536000000000000000000')
11-09-2013 09:59:47	SELECT f_almacena_lectura(0, 0, '2013-09-11 09:59:47', 1, 47, '466536000000000000000000')
11-09-2013 10:04:37	SELECT f_almacena_lectura(0, 0, '2013-09-11 10:04:37', 1, 47, '466536000000000000000000')
11-09-2013 10:04:37	SELECT f_almacena_lectura(0, 0, '2013-09-11 10:04:37', 1, 47, '466536000000000000000000')
11-09-2013 10:10:20	SELECT f_almacena_lectura(0, 0, '2013-09-11 10:10:20', 1, 47, '466536000000000000000000')
11-09-2013 10:10:20	SELECT f_almacena_lectura(0, 0, '2013-09-11 10:10:20', 1, 47, '466536000000000000000000')
11-09-2013 10:10:46	SELECT f_almacena_lectura(0, 1, '2013-09-11 10:10:46', 1, 47, '466536000000000000000000')
11-09-2013 10:10:46	SELECT f_almacena_lectura(0, 1, '2013-09-11 10:10:46', 1, 47, '466536000000000000000000')
11-09-2013 10:11:09	SELECT f_almacena_lectura(0, 0, '2013-09-11 10:11:09', 1, 47, '466536000000000000000000')
11-09-2013 10:11:09	SELECT f_almacena_lectura(0, 0, '2013-09-11 10:11:09', 1, 47, '466536000000000000000000')
11-09-2013 10:11:55	SELECT f_almacena_lectura(0, 1, '2013-09-11 10:11:55', 1, 47, '466536000000000000000000')
11-09-2013 10:12:16	SELECT f_almacena_lectura(0, 1, '2013-09-11 10:11:55', 1, 47, '466536000000000000000000') Conexin rechazada. Verifique que el nombre del Host y el puerto sean correctos y que postmaster este aceptando conexiones TCP/IP.
11-09-2013 11:16:21	SELECT f_almacena_lectura(0, 0, '2013-09-11 11:16:21', 1, 47, '466536000000000000000000')
11-09-2013 11:16:21	SELECT f_almacena_lectura(0, 0, '2013-09-11 11:16:21', 1, 47, '466536000000000000000000')
11-09-2013 11:16:26	SELECT f_almacena_lectura(0, 1, '2013-09-11 11:16:26', 1, 47, '466536000000000000000000')
11-09-2013 11:16:26	SELECT f_almacena_lectura(0, 1, '2013-09-11 11:16:26', 1, 47, '466536000000000000000000')
11-09-2013 11:16:35	SELECT f_almacena_lectura(0, 0, '2013-09-11 11:16:35', 1, 47, '466536000000000000000000')
11-09-2013 11:16:35	SELECT f_almacena_lectura(0, 0, '2013-09-11 11:16:35', 1, 47, '466536000000000000000000')
11-09-2013 11:16:45	SELECT f_almacena_lectura(0, 1, '2013-09-11 11:16:45', 1, 47, '466536000000000000000000')
11-09-2013 11:16:45	SELECT f_almacena_lectura(0, 1, '2013-09-11 11:16:45', 1, 47, '466536000000000000000000')
11-09-2013 11:16:46	SELECT f_almacena_lectura(0, 0, '2013-09-11 11:16:46', 1, 47, '466536000000000000000000')
11-09-2013 11:16:46	SELECT f_almacena_lectura(0, 0, '2013-09-11 11:16:46', 1, 47, '466536000000000000000000')
11-09-2013 11:16:52	SELECT f_almacena_lectura(0, 1, '2013-09-11 11:16:52', 1, 47, '466536000000000000000000')
11-09-2013 11:16:52	SELECT f_almacena_lectura(0, 1, '2013-09-11 11:16:52', 1, 47, '466536000000000000000000')
11-09-2013 11:17:02	SELECT f_almacena_lectura(0, 0, '2013-09-11 11:17:02', 1, 47, '466536000000000000000000')
11-09-2013 11:17:02	SELECT f_almacena_lectura(0, 0, '2013-09-11 11:17:02', 1, 47, '466536000000000000000000')
11-09-2013 11:17:13	SELECT f_almacena_lectura(0, 1, '2013-09-11 11:17:13', 1, 47, '466536000000000000000000')
11-09-2013 11:17:13	SELECT f_almacena_lectura(0, 1, '2013-09-11 11:17:13', 1, 47, '466536000000000000000000')
11-09-2013 12:08:41	SELECT f_almacena_lectura(0, 0, '2013-09-11 12:08:41', 1, 47, '466536000000000000000000')
11-09-2013 12:08:41	SELECT f_almacena_lectura(0, 0, '2013-09-11 12:08:41', 1, 47, '466536000000000000000000')
11-09-2013 12:08:46	SELECT f_almacena_lectura(0, 1, '2013-09-11 12:08:46', 1, 47, '466536000000000000000000')
11-09-2013 12:08:46	SELECT f_almacena_lectura(0, 1, '2013-09-11 12:08:46', 1, 47, '466536000000000000000000')
11-09-2013 12:09:21	SELECT f_almacena_lectura(0, 0, '2013-09-11 12:09:21', 1, 47, '466536000000000000000000')
11-09-2013 12:09:21	SELECT f_almacena_lectura(0, 0, '2013-09-11 12:09:21', 1, 47, '466536000000000000000000')
11-09-2013 12:09:33	SELECT f_almacena_lectura(0, 1, '2013-09-11 12:09:33', 1, 47, '466536000000000000000000')
11-09-2013 12:09:33	SELECT f_almacena_lectura(0, 1, '2013-09-11 12:09:33', 1, 47, '466536000000000000000000')
11-09-2013 12:09:48	SELECT f_almacena_lectura(0, 0, '2013-09-11 12:09:48', 1, 47, '466536000000000000000000')
11-09-2013 12:09:48	SELECT f_almacena_lectura(0, 0, '2013-09-11 12:09:48', 1, 47, '466536000000000000000000')
11-09-2013 12:10:18	SELECT f_almacena_lectura(0, 1, '2013-09-11 12:10:18', 1, 47, '466536000000000000000000')
11-09-2013 12:10:18	SELECT f_almacena_lectura(0, 1, '2013-09-11 12:10:18', 1, 47, '466536000000000000000000')
11-09-2013 12:10:24	SELECT f_almacena_lectura(0, 0, '2013-09-11 12:10:24', 1, 47, '466536000000000000000000')
11-09-2013 12:10:24	SELECT f_almacena_lectura(0, 0, '2013-09-11 12:10:24', 1, 47, '466536000000000000000000')
11-09-2013 01:33:52	SELECT f_almacena_lectura(0, 0, '2013-09-11 13:33:52', 1, 47, '2658000000000000000be6')
11-09-2013 01:33:53	SELECT f_almacena_lectura(0, 0, '2013-09-11 13:33:52', 1, 47, '2658000000000000000be6')
11-09-2013 01:34:11	SELECT f_almacena_lectura(0, 0, '2013-09-11 13:34:11', 1, 47, '2667000000100000000df2')
11-09-2013 01:34:11	SELECT f_almacena_lectura(0, 0, '2013-09-11 13:34:11', 1, 47, '2667000000100000000df2')
11-09-2013 01:34:19	SELECT f_almacena_lectura(0, 0, '2013-09-11 13:34:19', 1, 47, '445900000000000000025b')
11-09-2013 01:34:19	SELECT f_almacena_lectura(0, 0, '2013-09-11 13:34:19', 1, 47, '445900000000000000025b') ERROR: El EPC indicado no pertenece a un tipo de Objeto, esta lectura ser descartada
11-09-2013 01:34:20	SELECT f_almacena_lectura(0, 1, '2013-09-11 13:34:20', 1, 47, '2667000000100000000df2')
11-09-2013 01:34:20	SELECT f_almacena_lectura(0, 1, '2013-09-11 13:34:20', 1, 47, '2667000000100000000df2')
11-09-2013 01:34:21	SELECT f_almacena_lectura(0, 1, '2013-09-11 13:34:21', 1, 47, '2658000000000000000be6')
11-09-2013 01:34:21	SELECT f_almacena_lectura(0, 1, '2013-09-11 13:34:21', 1, 47, '2658000000000000000be6')
11-09-2013 01:34:28	SELECT f_almacena_lectura(0, 1, '2013-09-11 13:34:28', 1, 47, '445900000000000000025b')
